job_title,company,location,job_summary,post_date,more_info,salary,job_url
Senior Engineer (Seagate's Slider factory control system),Seagate Technology,Thailand,"Possess solid knowledge in data analytics and machine learning algorithms.
Experience in using R, SQL, Python, and its data analysis and data visualization…",Posted24 days ago,,,https://www.indeed.com/rc/clk?jk=9c9b980191e9bf1f&fccid=eb193642f8c64a12&vjs=3
Job Opportunity at Siam Macro,Siam Makro,กรุงเทพมหานคร,"We are willing to consider the university degree in a relevant discipline Information Technology, big data, data scientist, innovation, MBA, Finance.",Posted30+ days ago,,,https://www.indeed.com/rc/clk?jk=6a8d346a4a23c2f9&fccid=47aa4e1363ef5c2e&vjs=3
Job Opportunity at IUCN,International Union for Conservation of Nature...,กรุงเทพมหานคร,The Stakeholder Engagement and Communications Officer serves as regional lead in developing and implementing corporate communications strategies to support IUCN…,Posted19 days ago,,,https://www.indeed.com/rc/clk?jk=9b62aefeef16f047&fccid=f9d179614270f8ce&vjs=3
Senior/Staff Data Engineer (ML experienced),Coda Payments,กรุงเทพมหานคร,"Good understanding of data structures, data architecture techniques and data warehousing.
Working with data scientists and productionize machine learning…",Posted16 days ago,,,https://www.indeed.com/rc/clk?jk=bebac1950f85676a&fccid=734ef7de91560d87&vjs=3
Data Analyst and Big Data,บริษัท อาดิอุส เทคโนโลยี จำกัด,"บางเขน, กรุงเทพมหานคร",At least 1 - 5 years hands-on experience as a data scientist / statistician / machine learning engineer with understanding of ML/AI and related software…,Posted30+ days ago,,,https://www.indeed.com/rc/clk?jk=41ab009177148490&fccid=076b3fa8d7eeee68&vjs=3
Analytics Engineering ( ML Engineer ),ธนาคารไทยพาณิชย์,กรุงเทพมหานคร,"Develop and maintain data integration processes that are part of the bank’s data platform, whether building data pipelines or micro services or tools.",Posted30+ days ago,,,https://www.indeed.com/rc/clk?jk=a758a78507455134&fccid=5de6d81f2151c0f2&vjs=3
Mindshare | Head of Data Intelligence,Mindshare,กรุงเทพมหานคร,"You have in-depth understanding of the processes behind data management, data mining, data visualization and analytics modeling that can turn data into insights…",Posted30 days ago,,,https://www.indeed.com/rc/clk?jk=6b6203fd97f01c6f&fccid=7c09b9795120f0d4&vjs=3
Campaign Developer,ธนาคารไทยพาณิชย์,กรุงเทพมหานคร,"Advise business and data scientists how to automate model deployment into marketing/channel applications, together with collaborate with Data Analytics, CI,…",Posted30+ days ago,,,https://www.indeed.com/rc/clk?jk=df6ff7bb7cfa1b57&fccid=5de6d81f2151c0f2&vjs=3
Industrial App Development & Support Engineer,Siemens,กรุงเทพมหานคร,"O Work with data scientists/analysts to improve database.
Create security and data protection settings.
O Work with network/cloud engineering team to receive…",Posted30+ days ago,,,https://www.indeed.com/rc/clk?jk=580f2f6ad404d684&fccid=ea6bb53f0b18b8f2&vjs=3
Data Architecture,บริษัท มาร์เก็ตติ้ง ทรี จำกัด,กรุงเทพมหานคร,"� Knowledge of data mining and segmentation techniques.
� Research and experiment with emerging technologies and tools related to big data.",Posted30+ days ago,,,https://www.indeed.com/rc/clk?jk=84dda5c88bc9fc3a&fccid=0dae0e319af1c0ee&vjs=3
Digital Campaign Specialist with a passion for communication,Wunderman,กรุงเทพมหานคร,"Armed with the knowledge you need, you will become responsible for:
Creating e-mails in standard templates.
Sending out campaigns via e-mail, push, and SMS.",Posted30+ days ago,,,https://www.indeed.com/rc/clk?jk=eaae15215dfb176f&fccid=bfef2b2da6904e2a&vjs=3
"Head of Seeds Development, Thailand",Syngenta,นครสวรรค์,"Lead the advancements and ensure data driven decision making.
Plan and implement innovative field and laboratory initiatives, including mechanization,…",Posted25 days ago,,,https://www.indeed.com/rc/clk?jk=79daba6c9aaf0a03&fccid=212d266bb52619f8&vjs=3
"Account Manager, NSW Core Sales",NOKIA,กรุงเทพมหานคร,"With state-of-the-art software, hardware and services for any type of network, Nokia is uniquely positioned to help communication service providers, governments…",Posted10 days ago,,,https://www.indeed.com/rc/clk?jk=56a1b74c0ceed592&fccid=3444e7c94299ba32&vjs=3
Product Manager (Mid – Senior Level) - DataX,ธนาคารไทยพาณิชย์,กรุงเทพมหานคร,"Familiarity with data scientist concepts and practice is an advantage.
Strong analytical skills and having proven data-driven mindset.",Posted30+ days ago,,,https://www.indeed.com/rc/clk?jk=7980acaef431ce1f&fccid=5de6d81f2151c0f2&vjs=3
Data Scientist for Power-Commerce Trading,ห้างหุ้นส่วนจำกัด เอเชีย อีโวลูชั่น ทัวร์,เชียงใหม่,"The responsibility of the data scientist role is to identify business problems and translate those into.
Mathematical solvable problems, identify data sources…",Posted29 days ago,,,https://www.indeed.com/rc/clk?jk=decb207d4d42017d&fccid=dd616958bd9ddc12&vjs=3
Job Opportunity at AltoTech,AltoTech,กรุงเทพมหานคร,"These types of data can come in different formats and time scale (i.e. historical data, real-time data, and forecasted data).
Bachelor’s or Master/Ph.D.",Posted30+ days ago,,,https://www.indeed.com/rc/clk?jk=e49f5181165dba2c&fccid=71605d5dc3926553&vjs=3
BI Consultant,"M-Focus Co.,Ltd",กรุงเทพมหานคร,ศึกษาและติดตามการเปลี่ยนแปลงของเทคโนโลยี BI และ Data Warehouse ใหม่ๆ โดยสามารถนำสิ่งที่เรียนรู้มาประยุกต์ใช้ในงานได้อย่างมีประสิทธิภาพ.,Posted30+ days ago,,,https://www.indeed.com/rc/clk?jk=322aeefd98a4dfb2&fccid=93f270f3cf87c4a3&vjs=3
Supervisor - Digital Specialist,Banpu Public Company Limited,Thailand,"Perform the series of experiments with data and multiple algorithms.
Improve actionable insights from data/models through applying various algorithmic…",Posted30+ days ago,,,https://www.indeed.com/rc/clk?jk=ea3f78d504923f0c&fccid=eef428dec19aa1c8&vjs=3
Data Analyst Manager (Mergers & Acquisitions),PricewaterhouseCoopers Consulting Ltd.,กรุงเทพมหานคร,"At least five years of work experience in a data-related field e.g data analyst, data scientist, data engineer.
Solid business sense and commercial awareness.",Posted3 days ago,,,https://www.indeed.com/rc/clk?jk=628eb4a6c1559ea2&fccid=5e964c4afc56b180&vjs=3
SENIOR ACCOUNTANT,Archer Daniels Midland Company,กรุงเทพมหานคร,"Support data entry management for in-house systems.
Responsibilities include preparing month-end close procedures, ensuring accurate and timely reporting for…",Posted30+ days ago,,,https://www.indeed.com/rc/clk?jk=846086859d71450b&fccid=a46683ec51ead49e&vjs=3
Data Analyst (Manufacturing),RGF HR Agent,ปทุมธานี,"Collaborate cross-functionally with data scientists, business users, project managers and other engineers to achieve elegant solutions.",Posted30+ days ago,"25,000 - 35,000 บาทต่อเดือน","25,000 - 35,000 บาทต่อเดือน",https://www.indeed.com/rc/clk?jk=e02b31a32892b953&fccid=3fd016e76501eb7e&vjs=3
AM - Data Engineer,บริษัท แม็คกรุ๊ป จำกัด (มหาชน),กรุงเทพมหานคร,Performs data analysis required to troubleshoot data related issues and assist in the resolution of data issues.,Posted30+ days ago,,,https://www.indeed.com/rc/clk?jk=38476977135bab31&fccid=b380644c7d548a49&vjs=3
Zone Service Manager (In Vivo),Siemens Healthineers,กรุงเทพมหานคร,You will ensure proper data collection for any service incidents and process compliance based on Global Processes and Quality Regulations (QR) such as Good…,Posted2 days ago,,,https://www.indeed.com/rc/clk?jk=e3a440654be37cae&fccid=c5679bf29a1db253&vjs=3
Job Opportunity at SEI,Stockholm Environment Institute (SEI),กรุงเทพมหานคร,"Competent in quantitative, qualitative or mixed methods approaches, including rigorous design, collection and data analysis.",Posted30+ days ago,,,https://www.indeed.com/rc/clk?jk=9392667a47adeb95&fccid=cc96696ec27a5bc5&vjs=3
Customer Service Engineer (CT/ MR/ MI),Siemens Healthineers,กรุงเทพมหานคร,"This position requires travel and work in South (including Pattani, Yala and Narathiwat), North, and East Thailand.",Posted30+ days ago,,,https://www.indeed.com/rc/clk?jk=67885344ae2adc12&fccid=c5679bf29a1db253&vjs=3
Sales Executive (Diagnostics),Siemens Healthineers,กรุงเทพมหานคร,Then come and join our Thailand team as Sales Executive (Diagnostics) to plan and execute sales targets and activities by combining and leveraging specialized…,Posted19 days ago,,,https://www.indeed.com/rc/clk?jk=6c9c098d57d1ea7a&fccid=c5679bf29a1db253&vjs=3
Python Developer,Kensington Associates Recruitment,กรุงเทพมหานคร,"In addition, we maintain the appropriate technical and organizational measures to protect your personal data against unauthorized or unlawful processing and/or…",Posted30+ days ago,,,https://www.indeed.com/rc/clk?jk=7c491835f4435eac&fccid=beb90e4d7738b223&vjs=3
Head of Data & Business Analytics,PRTR,กรุงเทพมหานคร,"Developing and implementing data systems, data pipelines, ETL and business intelligence for business solutions.
Performance bonus + fixed bonus.",Posted29 days ago,,,https://www.indeed.com/rc/clk?jk=be41e3091c33c66f&fccid=5c6a642d8c482c44&vjs=3
Connect Platform Manager,ธนาคารไทยพาณิชย์,กรุงเทพมหานคร,"Drive the execution of platform vision by working closely with cross-functional teams, including technology, data scientist, marketing, and businesses.",Posted30+ days ago,,,https://www.indeed.com/rc/clk?jk=8e7a3216128f818f&fccid=5de6d81f2151c0f2&vjs=3
Digital & Automation Consultant,Siemens Healthineers,กรุงเทพมหานคร,"Business Planning: To accelerate and drive sales funnel to close, order, revenue and profit growth in digital & automation business.",Posted30+ days ago,,,https://www.indeed.com/rc/clk?jk=109782b8fb9d00cc&fccid=c5679bf29a1db253&vjs=3
Capital Markets and Treasury Risk Modeling System Manager,KBANK,กรุงเทพมหานคร,"มีประสบการณ์อย่างน้อย 1 ปี ในงาน Data scientist, Data Analyst.
ออกแบบและพัฒนากระบวนการดูแลแบบจำลองความเสี่ยงที่มีประสิทธิผลและสอดคล้องกับมาตรฐานสากลและกฎเกณฑ์ต…",Posted30+ days ago,,,https://www.indeed.com/rc/clk?jk=ce5061bf68ac0fe1&fccid=944d84bae93a0556&vjs=3
Business Intelligence Analyst,PRTR,"ปทุมวัน, กรุงเทพมหานคร","Strong knowledge of reports, dashboards, ETL and data analytics.
Technical skills: Tableau, PowerBI, SQL, Python, and data platform systems.",Posted29 days ago,,,https://www.indeed.com/rc/clk?jk=d33900cc94d90f15&fccid=5c6a642d8c482c44&vjs=3
Data Science Engineer(SCG Chemicals) Rayong Based,SCG,ระยอง,"Work and engage with Partner to build the data scientist resource pools and ecosystem.
Proven ability to apply analytical and creative thinking to problem-solve…",Posted30+ days ago,,,https://www.indeed.com/rc/clk?jk=1be6cfa1dc7febd9&fccid=132b3056152ea260&vjs=3
"Business Development Manager, Business Insights",AXIATA DIGITAL & ANALYTICS,กรุงเทพมหานคร,Data Strategy Consulting – Utilising our technology consulting expertise to help client identify right data strategies that align with business strategy and…,Posted30+ days ago,,,https://www.indeed.com/rc/clk?jk=cd33b26734280d42&fccid=f8eac294fd76e571&vjs=3
data governance officer โทร line ไนน์,"P.R. Recruitment and Business Management Co.,Ltd","สาทร, กรุงเทพมหานคร","Take care of quality of the data, ensuring data analysts and data scientists can trust the data provided to them.
Fix Bonus 1 เดือน (ได้ต่อเมื่อทำงาน ครบ 1 ปี).",Posted30+ days ago,,,https://www.indeed.com/rc/clk?jk=10fa6b624cb79a6b&fccid=62d9eb18576766e4&vjs=3
Research Manager (Food Scientist),PRTR,กรุงเทพมหานคร,"Researching, analyzing, and summarizing research data.
Excellent numeral skills and an understanding of data analysis/statistical methods.",Posted30+ days ago,,,https://www.indeed.com/rc/clk?jk=ba64e79523dc33c4&fccid=5c6a642d8c482c44&vjs=3
Data Engineer Specialist,PRTR,กรุงเทพมหานคร,"Maintaining the overall data engineer, data strategy for data system and framework.
Leading and driving projects, also managing the data engineer team with Data…",Posted30+ days ago,,,https://www.indeed.com/rc/clk?jk=48dcd99bf033c416&fccid=5c6a642d8c482c44&vjs=3
"CS AP Regional HQ Application Specialist, MRI",Siemens Healthineers,กรุงเทพมหานคร,"You are responsible for the delivery of Application Services (Training and Support) in pre-sales, implementation, and after-sales for MRI.",Posted30+ days ago,,,https://www.indeed.com/rc/clk?jk=d011ee5f25eb1402&fccid=c5679bf29a1db253&vjs=3
Business Intelligence Manager,PRTR,กรุงเทพมหานคร,"You will Implement Business Intelligence and Business analytics, develop pricing and market strategy and customer segmentation.
Performance bonus + Fixed bonus.",Posted30+ days ago,,,https://www.indeed.com/rc/clk?jk=39edf4f5fa2c15f0&fccid=5c6a642d8c482c44&vjs=3
Business Analytics Analyst,ExxonMobil,กรุงเทพมหานคร,"Advanced data mining to find insights or correlations within the data.
Responsible for data design and code-writing to transform, reshape or measure data to…",Posted30+ days ago,,,https://www.indeed.com/rc/clk?jk=e76047eb0d95a5ee&fccid=1ddb91d85c72e885&vjs=3
Python Developer (Django REST API TDD AWS CI/CD) x 3,Kensington Associates Recruitment,กรุงเทพมหานคร,"In addition, we maintain the appropriate technical and organizational measures to protect your personal data against unauthorized or unlawful processing and/or…",Posted30+ days ago,,,https://www.indeed.com/rc/clk?jk=7bf173fa1a5dad87&fccid=beb90e4d7738b223&vjs=3
Senior Account Manager (In-Vivo),Siemens Healthineers,กรุงเทพมหานคร,Then come and join our Thailand team as Senior Account Manager (In-Vivo) to plan and execute sales targets and activities in Thailand for the portfolio of…,Posted30+ days ago,,,https://www.indeed.com/rc/clk?jk=216f2e8237f84863&fccid=c5679bf29a1db253&vjs=3
Data Scientist(Candidate of Leader),RGF,กรุงเทพมหานคร,"Actively monitor, review, and analyze data from internal and external data sources to ensure the coverage of all data/information perspectives.",Posted30+ days ago,,,https://www.indeed.com/rc/clk?jk=f86b10128aa21cec&fccid=3fd016e76501eb7e&vjs=3
Data Scientist Analytics - Team Lead,PRTR,กรุงเทพมหานคร,"Developing and building Machine Learning, data model, Deep learning in Data platform.
Maintain and creating data analytics, business model, API for Data…",Posted30+ days ago,,,https://www.indeed.com/rc/clk?jk=791c962ec7d86d96&fccid=5c6a642d8c482c44&vjs=3
Advanced Therapy Business Manager,Siemens Healthineers,กรุงเทพมหานคร,"You will be responsible for driving Advanced Therapy business (Cardiovascular Care, Corindus – Robotic-assisted Vascular Intervention, Interventional Radiology,…",Posted30+ days ago,,,https://www.indeed.com/rc/clk?jk=d222c35c6dc1d2a9&fccid=c5679bf29a1db253&vjs=3
Regional Sales Manager Southeast Asia (m/f/d),CENTOGENE GMBH,กรุงเทพมหานคร,"Responsible for business development and sales of CENTOGENE services & products in Southeast Asia.
Autonomous planning and implementation of sales activities.",Posted16 days ago,,,https://www.indeed.com/company/Centogene-GmbH/jobs/Regional-Sales-Manager-Southeast-Asia-7ed15e90f09145c7?fccid=f7b706a310ce5893&vjs=3
PRTR เปิดรับสมัครตำแหน่ง Data Processing Executive ทำงานร่วม...,"P.R. Recruitment and Business Management Co.,Ltd","พระนคร, กรุงเทพมหานคร",สนับสนุน Data Team เพื่อจัดเตรียมข้อมูลก่อนส่งให้ผู้รับเหมาของยูนิเซฟ (การล้างข้อมูล การตรวจสอบซ้ำ และการจัดรูปแบบ).,Posted30+ days ago,"20,000 - 25,000 บาทต่อเดือน","20,000 - 25,000 บาทต่อเดือน",https://www.indeed.com/rc/clk?jk=ca632801c96d32e0&fccid=62d9eb18576766e4&vjs=3
System Engineer,บริษัท จัดหางาน เพอร์ซันแนล คอนซัลแตนท์...,สมุทรปราการ,"Functionally with data scientists, business users, project managers, and other engineers to achieve elegant solutions.
Analyze, design, and develop tests.",Posted30+ days ago,"25,000 - 35,000 บาทต่อเดือน","25,000 - 35,000 บาทต่อเดือน",https://www.indeed.com/rc/clk?jk=96bc57f9b12e63d2&fccid=cdc42f9cb73ee0fd&vjs=3
Solution Engineer – Products (Business Messaging),AXIATA DIGITAL & ANALYTICS,กรุงเทพมหานคร,"As the Solution Engineer Products, you will be the bridge between client-facing and technical implementation teams to communicate and update the product…",Posted30+ days ago,,,https://www.indeed.com/rc/clk?jk=ff3f965e5e0e245f&fccid=f8eac294fd76e571&vjs=3
Financial Analyst (Data Engineer),PRTR,กรุงเทพมหานคร,"Experience building and optimizing ‘big data’ data pipelines, architectures, and data sets.
Creating data tools for analytics and data scientist team members…",Posted30+ days ago,,,https://www.indeed.com/rc/clk?jk=4b3ec5058d15aa02&fccid=5c6a642d8c482c44&vjs=3
Stakeholder Engagement and Communications Officer,International Union for Conservation of Nature,กรุงเทพมหานคร,"Type of contract: Fixed-term (24 months with possibility of renewal).
The Stakeholder Engagement and Communications Officer serves as regional lead in…",Posted30+ days ago,,,https://www.indeed.com/rc/clk?jk=7f8c0c840c7f71ab&fccid=c6dab415dd8515a7&vjs=3
BI Development Manager,บริษัท เอ็มโฟกัส จำกัด,"จตุจักร, กรุงเทพมหานคร","ศึกษาและติดตามการเปลี่ยนแปลงของเทคโนโลยี BI และ Data Warehouse ใหม่ๆ โดยสามารถนำสิ่งที่เรียนรู้มาประยุกต์ใช้ในงานได้อย่างมีประสิทธิภาพ.
สามารถสร้าง Database.",Posted30+ days ago,,,https://www.indeed.com/rc/clk?jk=d89a0108e7ece007&fccid=c729e37250ccb364&vjs=3
