job_title,company,location,job_summary,post_date,more_info,salary,job_url
Consultant - Data Scientist - TH,Deloitte,กรุงเทพมหานคร,"Designing and developing data integration (including batch/real-time, ETL/ELT) processes with a variety of structured and unstructured data with tools such as…",Posted30+ days ago,,,https://www.indeed.com/rc/clk?jk=30c7339850dc950e&fccid=9e215d88a6b33622&vjs=3
Data Scientist,CPF IT Center,Thailand,"Experience working with big data systems and big data concepts.
Visualize data to tell compelling stories.
Perform elements of data cleaning, feature selection…",Posted30+ days ago,,,https://www.indeed.com/rc/clk?jk=3f94845953e37b17&fccid=6161377d923dc529&vjs=3
Data Scientist,SiPH Hospital,"บางพลัด, กรุงเทพมหานคร",2 years+ relevant experience in healthcare industry and/or more than 5 years of experience as data scientist from healthcare or other industries.,Posted30+ days ago,,,https://www.indeed.com/rc/clk?jk=fbac50d8c61432ad&fccid=72d75a27f9912bb6&vjs=3
Data Analyst,บริษัท อีซี่บาย จำกัด (มหาชน),"ราชเทวี, กรุงเทพมหานคร","Acquire data from primary or secondary data sources and maintain databases/data systems.
Develop and implement data collection systems and other strategies that…",Posted30+ days ago,,,https://www.indeed.com/rc/clk?jk=72b6c822053a4333&fccid=4371818e7027a7b2&vjs=3
Machine Operator,Cargill,สระบุรี,The Senior Engineer Technician will provide technical support to our engineers and scientists on a variety of technical tasks.,PostedToday,,,https://www.indeed.com/rc/clk?jk=53260e0211e69716&fccid=d7d9a8241ba2f3ec&vjs=3
Data Scientist,บริษัท เนาวรัตน์พัฒนาการ จำกัด (มหาชน),"บางพลี, สมุทรปราการ",เงินเดือน : ตามประสบการณ์ คุณสมบัติผู้สมัคร : เพศชาย-หญิง อายุ 23 ปีขึ้นไป วุฒิการศึกษาระดับ ปริญญาตรี สาขา คณิตศาสตร์วิทยาการเชิงคอมพิวเตอร์ และสาขาอื่นที…,Posted30+ days ago,,,https://www.indeed.com/rc/clk?jk=b52f1c9096a6634f&fccid=b89ae7b7625ab7cf&vjs=3
Data Scientist,บริษัท ธนาคารกรุงเทพ จำกัด (มหาชน),"สาทร, กรุงเทพมหานคร","Identifies what data is available and relevant, including internal and external data sources, leveraging new data collection processes such as sensor data, geo…",Posted30+ days ago,,,https://www.indeed.com/rc/clk?jk=ffd00ab5b50348bc&fccid=ab72e4d36bdc5e44&vjs=3
Data Scientist,กลุ่มบริษัทซีดีจี,กรุงเทพมหานคร,"2-3 years’ experience in implementing Big Data solutions for enterprise data analysis.
Serves as a virtual team for customers on data analysis, presenting,…",Posted30+ days ago,,,https://www.indeed.com/rc/clk?jk=f6f65520aaaa5148&fccid=6dd41f6e749f69e2&vjs=3
Data Scientist,ExxonMobil,กรุงเทพมหานคร,Collaborate with stakeholders to determine data collection needs and appropriate data resources for specific projects or initiatives.,Posted30+ days ago,,,https://www.indeed.com/rc/clk?jk=4d24f9e4a984b029&fccid=1ddb91d85c72e885&vjs=3
Senior Data Scientist,LSEG (London Stock Exchange Group),กรุงเทพมหานคร,"This application involves real-time high frequency and time series data including static referenced and fundamental data.
Fluent in spoken and written English.",Posted30+ days ago,,,https://www.indeed.com/rc/clk?jk=7e6ea3395fc9d071&fccid=2d181105260f6454&vjs=3
Data Scientist,บริษัท อยุธยา แคปปิตอล ออโต้ ลีส จำกัด (มหาชน),กรุงเทพมหานคร,"Present information using data visualization techniques.
Undertake preprocessing of structured and unstructured data.
Combine models through ensemble modeling.",Posted30+ days ago,,,https://www.indeed.com/rc/clk?jk=0e1d806f8f4222cb&fccid=0aba939eba1dff41&vjs=3
Data Scientist,SKY ICT PCL,กรุงเทพมหานคร,"Studying Computer Engineering, AI, or Computer Science.
Basic knowledge of Statistics and Microsoft Excel (Visualization).",Posted30+ days ago,,,https://www.indeed.com/rc/clk?jk=8426645fb9eff1d2&fccid=4948476bdcced0d9&vjs=3
Data Scientist,Coda Payments,กรุงเทพมหานคร,"At Coda, remote and flexible working arrangements take centre stage for Codans to work smartly and have autonomy in how they work.
Hands on experience with SQL.",Posted16 days ago,,,https://www.indeed.com/rc/clk?jk=543127d0de074e4b&fccid=734ef7de91560d87&vjs=3
Data Scientist / Data Analyst,Textile Prestige PCL,กรุงเทพมหานคร,"Manage and ensure the reliability of data in Corporate database.
Specials experience with SQL, BI tools and working with large data sets.",Posted30+ days ago,,,https://www.indeed.com/rc/clk?jk=ba21374373ac786e&fccid=b3ec0515112230bb&vjs=3
Graduate Electrical Engineer,Worley,Thailand,"Assist with the preparation of detailed designs and drawings, specifications, data, calculations and reports.
As part of the Worley Graduate Community and under…",Posted30+ days ago,,,https://www.indeed.com/rc/clk?jk=42ca2f4f29d9f7b5&fccid=d9805af20a6c196e&vjs=3
Data Scientist - Hatch,Ascend Group,กรุงเทพมหานคร,Explore and understand large enterprise data sets (‘big data’) with varying complicity to lead effective analysis delivery.,Posted30+ days ago,,,https://www.indeed.com/rc/clk?jk=9f0fd1eaed407c50&fccid=e86c0d8bfd3a4b00&vjs=3
Data Scientist - CGS Business,The Siam Cement PLC (SCG),กรุงเทพมหานคร,"Experience with data analytics platform like Data bricks, Snowflake is preferred.
Experience with business intelligence and data visualization tools like MS…",Posted1 day ago,,,https://www.indeed.com/rc/clk?jk=ea7a41a6c1bd65cc&fccid=5d2feb62178ae3cb&vjs=3
Data Scientist,LINE Plus corporation,กรุงเทพมหานคร,"Lead analytical initiatives that leverage our data assets to generate insights through hands-on data science techniques.
Another model such as income model.",Posted30+ days ago,,,https://www.indeed.com/rc/clk?jk=120066b1ead84fee&fccid=e90e80bc9ed9a53f&vjs=3
"Data Science, Specialist",AIA,กรุงเทพมหานคร,"Responsible for creating data modelling tools to identify opportunities through insight from data.
Prepare data from different data sets for building predictive…",Posted18 days ago,,,https://www.indeed.com/rc/clk?jk=93f1ef04ed23fe91&fccid=004041685e219574&vjs=3
Data Scientist,เบทาโกร,"หลักสี่, กรุงเทพมหานคร","Prepare report or visualization of data for excusive and project team.
Collect and organize structure and un-structure data into usable format.",Posted13 days ago,,,https://www.indeed.com/rc/clk?jk=3ed722f714850b70&fccid=8e4c9e79d871cc42&vjs=3
Data Engineer,Tisco Bank PCL,"บางรัก, กรุงเทพมหานคร","With data-related technical issues and support their data infrastructure needs.
Building data pipeline for data preparation and transformation for analytics and…",Posted30+ days ago,,,https://www.indeed.com/rc/clk?jk=bd3808c504e07c53&fccid=d36967836b168b3c&vjs=3
Structural Engineer,AECOM,Thailand,"Gathers and correlates basic engineering data using established and well-defined procedures.
Works on detailed or routine engineering assignments involving…",Posted30+ days ago,,,https://www.indeed.com/rc/clk?jk=b55e85d65ec381ea&fccid=bafa4b35e9cd20ce&vjs=3
Data Analyst / Data Scientist (Senior),Business Online PCL (BOL),กรุงเทพมหานคร,"Business Intelligence tools for data democratisation.
Research for better improvements in data analytics area.
Evaluate performance for product experimentation.",Posted30+ days ago,,,https://www.indeed.com/rc/clk?jk=f57bc1cf02f00775&fccid=69efe79dba13f942&vjs=3
Data scientist,บริษัท รู้ใจ จำกัด,ชลบุรี,"As a member of the data analytics team, the data scientist is responsible to develop, improve, and maintain our data-driven projects.",Posted30+ days ago,,,https://www.indeed.com/rc/clk?jk=0ab1043f0ac40482&fccid=9c8c04f40e5fdb63&vjs=3
Data Scientist,Accenture,กรุงเทพมหานคร,"Prepare, optimize and deploy data preparation process.
Provide data delivery pipeline based on Company’s Azure cloud environment.",Posted30+ days ago,,,https://www.indeed.com/rc/clk?jk=27fb0a9d4d1c8d8e&fccid=a4e4e2eaf26690c9&vjs=3
Data Scientist - Ascend Commerce,Ascend Group,กรุงเทพมหานคร,Explore and understand large enterprise data sets (‘big data’) with varying complicity to lead effective analysis delivery.,Posted30+ days ago,,,https://www.indeed.com/rc/clk?jk=7ba200a61f48aced&fccid=e86c0d8bfd3a4b00&vjs=3
Electrical Associate,AECOM,กรุงเทพมหานคร,"AECOM Thailand is seeking to hire an Electrical Associate for our Thai Office.
The vacancy is for the position in the area of Electrical Engineering with a…",Posted30+ days ago,,,https://www.indeed.com/rc/clk?jk=1f83eecebb326a0d&fccid=bafa4b35e9cd20ce&vjs=3
AI Data Scientist,PERSOLKELLY HR Services Recruitment (Thailand)...,"สาทร, กรุงเทพมหานคร","Help to analyze the data and make statistical test, reports.
To support customers for transforming their busienss to AI modeling.",Posted30+ days ago,"50,000 - 70,000 บาทต่อเดือน","50,000 - 70,000 บาทต่อเดือน",https://www.indeed.com/rc/clk?jk=90751c65ed7bf489&fccid=8ec5dcef1e43798c&vjs=3
Data Engineer / Big Data Engineer (SQL skill is a must),Muang Thai Life Assurance,"ห้วยขวาง, กรุงเทพมหานคร","Prepare data & tools for data analyst and data scientist team.
Experience in data warehouse design.
Design optimal data models that suits with either structured…",Posted30+ days ago,,,https://www.indeed.com/rc/clk?jk=597349892aad6cfa&fccid=7c9a41971392de77&vjs=3
Junior Data Scientist,dFusion,กรุงเทพมหานคร,"Knowledge of R, python and other data science software are plus.
Utilize machine learning techniques on complex data, and convert the results into business…",Posted30+ days ago,,,https://www.indeed.com/rc/clk?jk=8fcae2979782b199&fccid=f9dd087416080f51&vjs=3
Data Scient,บริษัท วินเกม เทค คอร์ปอเรชั่น จำกัด,"บึงกุ่ม, กรุงเทพมหานคร",พัฒนาโครงการด้วยเทคโนโลยี Internet of Things เพื่อพัฒนางานเก็บและบันทึกข้อมูลต่างๆ จากพื้นที่ทำงานอย่างมีประสิทธิภาพ.,Posted30+ days ago,"25,000 - 60,000 บาทต่อเดือน","25,000 - 60,000 บาทต่อเดือน",https://www.indeed.com/rc/clk?jk=8d56c36571b8f5b5&fccid=709fa8a9034b366f&vjs=3
GroupM | Data Analytics and Reporting Development,GroupM Services,กรุงเทพมหานคร,"Become an active collaborator on the wider data technology, data scientist, analytics, biddable and strategy teams by attending team trainings and activities.",Posted3 days ago,,,https://www.indeed.com/rc/clk?jk=84b8945d753a82ba&fccid=feb484a8aef310be&vjs=3
Data Scientist,Grandline Innovation,"สาทร, กรุงเทพมหานคร","Analyze data using statistical methods.
Document structures and types of business data.
Collaborate with leaders and managers to determine and address data and…",Posted30+ days ago,,,https://www.indeed.com/rc/clk?jk=9d14e34d0a856e8b&fccid=f04356d3be248295&vjs=3
Machine Learning / Data Scientist Credit Scoring & Model (As...,Ascend Group,กรุงเทพมหานคร,"Familiar with data transformation process.
Can leverage data usage in order to enhance score’s predictive power.
Be able to suggest how to use developed scores.",Posted30+ days ago,,,https://www.indeed.com/rc/clk?jk=f824accc4a5aa13a&fccid=e86c0d8bfd3a4b00&vjs=3
Data Engineer,ไทยรัฐออนไลน์,"จตุจักร, กรุงเทพมหานคร","Collaborate with data scientists, data analyst, or stakeholders on several projects.
Knowledge of data processing supporting data transformation, data…",Posted30+ days ago,,,https://www.indeed.com/rc/clk?jk=4057d4bbcc562119&fccid=4d60ad771c97cf37&vjs=3
Data Scientist - CGS Business,SCG,กรุงเทพมหานคร,"Experience with data analytics platform like Data bricks , Snowflake is preferred.
Experience with business intelligence and data visualization tools like MS…",Posted29 days ago,,,https://www.indeed.com/rc/clk?jk=22fe82f38971ec91&fccid=132b3056152ea260&vjs=3
"Data Scientist, Advanced Analytics",Pandora Jewelry,"ประเวศ, กรุงเทพมหานคร","3+ years industry experience in particular within big data application scenarios,.
Partner with our stakeholders to identify valuable insights and in depth…",Posted30+ days ago,,,https://www.indeed.com/rc/clk?jk=69af5daf67457dbe&fccid=d52b9b25e32242d5&vjs=3
Office Administrator,Wunderman,กรุงเทพมหานคร,"Providing administrative and clerical support to Global Marketing Operations team.
Acting as a liaison with the HR teams in Bangkok and our other global offices…",Posted8 days ago,,,https://www.indeed.com/rc/clk?jk=d45b7688d2e910f4&fccid=bfef2b2da6904e2a&vjs=3
Welder Technician,Cargill,สระบุรี,The Senior Engineer Technician will provide technical support to our engineers and scientists on a variety of technical tasks.,Posted30+ days ago,,,https://www.indeed.com/rc/clk?jk=52f3aedd085aedc5&fccid=d7d9a8241ba2f3ec&vjs=3
Consulting Analyst,McKinsey & Company,กรุงเทพมหานคร,"You’ll work in teams of typically 3 - 5 consultants, playing an active role in all aspects of the client engagement.
Outstanding record of academic achievement.",Posted30+ days ago,,,https://www.indeed.com/rc/clk?jk=a5d72ef36e7d6ade&fccid=6576e7250aa78c3c&vjs=3
Data scientist/Data PMO,KBANK,กรุงเทพมหานคร,"Data scientist - At least 3 years experience in using Data scientist.
Manage to have all necessary data available timely.",Posted30+ days ago,,,https://www.indeed.com/rc/clk?jk=76bc11a781e3aee0&fccid=944d84bae93a0556&vjs=3
Data Architect,Muang Thai Life Assurance,"ห้วยขวาง, กรุงเทพมหานคร","Prepare data & tools for data analyst and data scientist team.
Additional: - Experience building data warehouse and big data platform.",Posted30+ days ago,,,https://www.indeed.com/rc/clk?jk=d786475ef819ef42&fccid=7c9a41971392de77&vjs=3
Construction Management Supervisor (M&E),AECOM,กรุงเทพมหานคร,"Performs a variety of tasks in support of survey or construction activities.
Activities may include setting up and operating equipment; inspecting equipment;…",Posted30+ days ago,,,https://www.indeed.com/rc/clk?jk=c09cb8b6d7933704&fccid=bafa4b35e9cd20ce&vjs=3
"Data engineer,Data scientist",บริษัท เจริญเภสัชแล็บ จำกัด,"ภาษีเจริญ, กรุงเทพมหานคร","บริหารจัดการและดำเนินการเกี่ยวกับระบบ MS Office365, MS Dynamic AX.
ทักษะโปรแกรม ERP Microsoft dynamics ax.",Posted20 days ago,,,https://www.indeed.com/rc/clk?jk=950977f21539e45f&fccid=47f92bf656000d06&vjs=3
Data Scientist,"PTT ICT Solutions Co.,Ltd","จตุจักร, กรุงเทพมหานคร",Do the analytical tasks: data exploring / data preparation / analytics model building and tuning / visualization and report.,Posted30+ days ago,,,https://www.indeed.com/rc/clk?jk=2eab07819eaca921&fccid=ce02467d68b56248&vjs=3
Data Scientist / Digital Expert (Rayong),PRTR,ระยอง,"Managing the full cycle of automation.
Implementing industry 4.0 regarding with plant roadmap.
Leading the SAP implementation activities on behalf of the plant…",PostedPosted 30+ days ago,,,https://www.indeed.com/rc/clk?jk=7abf80e2a30c8d3e&fccid=5c6a642d8c482c44&vjs=3
RCC MIS,ธนาคารเกียรตินาคินภัทร จำกัด (มหาชน),กรุงเทพมหานคร,"Responsible on managing data to support the retail banking business, customer data, credit analysis, payment data, collection efficiency, individual performance…",PostedPosted 30+ days ago,,,https://www.indeed.com/rc/clk?jk=c0f97a3e404008c5&fccid=647f9ecdccabd188&vjs=3
Quantitative Researcher (Quant Research),บริษัท เคเคพี แคปปิตอล จำกัด (มหาชน),กรุงเทพมหานคร,"Previous experience as a quant or data scientist in a research-focused capacity.
Extract predictive signals from various financial market data using…",PostedPosted 30+ days ago,,,https://www.indeed.com/rc/clk?jk=7c1387b0f11f4893&fccid=9f279464bffb263f&vjs=3
System Engineer (Innovation Team),บริษัท นิภา เทคโนโลยี จำกัด,"บางรัก, กรุงเทพมหานคร","Provides architectural expertise, direction and assistance to developers, data engineers, data scientists, system administrators and managers.",PostedPosted 30+ days ago,,,https://www.indeed.com/rc/clk?jk=d568948e0bb1188c&fccid=02f2651c98c73ce8&vjs=3
Executive Cost Engineer,AECOM,กรุงเทพมหานคร,"Researches legal records, looks for evidence of previous boundaries, and analyzes the data to determine the location of boundary lines.",PostedPosted 29 days ago,,,https://www.indeed.com/rc/clk?jk=e99687d18d16e5bd&fccid=bafa4b35e9cd20ce&vjs=3
"Associate, Architectural",AECOM,กรุงเทพมหานคร,"+ Project experience in data centers, commercial, residential, retail, healthcare, hospitality, industrial, aviation sectors will be helpful.",PostedPosted 30+ days ago,,,https://www.indeed.com/rc/clk?jk=ad01fc4369a218f2&fccid=bafa4b35e9cd20ce&vjs=3
Data Scientist : นักวิทยาศาสตร์ข้อมูล ( 0 ตำแหน่ง ),Samart,"ปากเกร็ด, นนทบุรี","Experience using statistical computer languages (R, Python, SLQ, etc.) to manipulate data and draw insights from large data sets.",PostedPosted 30+ days ago,,,https://www.indeed.com/rc/clk?jk=aaccd2a2c71d4331&fccid=04acabbfe09b5d56&vjs=3
Data Engineer - Ascend Commerce,Ascend Group,กรุงเทพมหานคร,"Work with business domain experts, data scientists and application developers to identify data that is relevant for analysis.",PostedPosted 30+ days ago,,,https://www.indeed.com/rc/clk?jk=19315d57f891b79a&fccid=e86c0d8bfd3a4b00&vjs=3
Dev - Python . R . Data Scientist,บริษัท แอคชัวเรียล บิสซิเนส โซลูชั่น จำกัด,"ธนบุรี, กรุงเทพมหานคร","รายละเอียดงาน รูปแบบงาน : งานประจำ จำนวนที่รับ : ไม่ระบุ สถานที่ปฏิบัติงาน : กรุงเทพมหานคร(เขตธนบุรี) เงินเดือน(บาท) : ตามตกลง วันหยุด : วันเสาร์, วันอาทิตย์…",PostedPosted 30+ days ago,,,https://www.indeed.com/rc/clk?jk=6b2f4d30d14db61e&fccid=7d43c5a25ecb4be0&vjs=3
Data Scientist (Chemicals Business),SCG,กรุงเทพมหานคร,"Support to build the data scientist ecosystem.
Drives the collection of new data and the refinement of existing/new data sources, including internal and…",PostedPosted 30+ days ago,,,https://www.indeed.com/rc/clk?jk=6c7066c2ddbd0632&fccid=132b3056152ea260&vjs=3
Mechanical Associate,AECOM,กรุงเทพมหานคร,"The vacancy is for the position in the area of Mechanical Engineering with a specialization in HVAC & Refrigeration.
Able to speak and write English fluently.",PostedPosted 30+ days ago,,,https://www.indeed.com/rc/clk?jk=f1768ab5eda28d80&fccid=bafa4b35e9cd20ce&vjs=3
Data Analyst,บริษัท โมโน เน็กซ์ จำกัด (มหาชน),นนทบุรี,"ประสบการณ์ 1 ปี ด้านงานวิจัย,สถิติ,วิเคราะห์ข้อมูล,data scientist,data engineer,data mining หรืองานที่เกี่ยวข้องกับด้านข้อมูล.",PostedPosted 5 days ago,,,https://www.indeed.com/rc/clk?jk=d69e8822f952c74a&fccid=b16dd6bf109865f7&vjs=3
Data Analyst Manager (Mergers & Acquisitions),PwC,กรุงเทพมหานคร,"At least five years of work experience in a data-related field e.g data analyst, data scientist, data engineer.
Solid business sense and commercial awareness.",PostedPosted 30+ days ago,,,https://www.indeed.com/rc/clk?jk=bd5efe02f043a2cd&fccid=5e964c4afc56b180&vjs=3
Data Engineer / Cloud Data Engineer (SQL skill is a must),Muang Thai Life Assurance,"ห้วยขวาง, กรุงเทพมหานคร","Prepare data & tools for data analyst and data scientist team.
Experience on data warehouse, big data technology, data engineering.",PostedPosted 30+ days ago,,,https://www.indeed.com/rc/clk?jk=8e4f3bb0d7ddbd22&fccid=7c9a41971392de77&vjs=3
Senior Data Analyst - BI developer,Siemens Gamesa Renewable Energy,กรุงเทพมหานคร,"You have experience in data warehouse design (e.g. dimensional modelling) and data mining, and you also have experience working with data analytics and the…",PostedPosted 15 days ago,,,https://www.indeed.com/rc/clk?jk=f7ff4b91164f437e&fccid=80ce8fe747cb0aff&vjs=3
Senior Data Scientist (ต้องการด่วนมาก),บริษัท โสมาภา อินฟอร์เมชั่น เทคโนโลยี จำกัด...,กรุงเทพมหานคร,เป็นผู้ที่ควบคุมดูแลการวิเคราะห์วิจัยข้อมูลเพื่อให้ได้ตัวแบบ (Model) ที่ตอบโจทย์ของปัญหาที่ลูกค้าต้องการไม่ว่าจะเป็นการพยากรณ์ (Predictive) การวินิจฉัย …,Posted30+ days ago,"50,000 - 70,000 บาทต่อเดือน","50,000 - 70,000 บาทต่อเดือน",https://www.indeed.com/rc/clk?jk=e38e5fa313bbba84&fccid=5ef252340efe8aca&vjs=3
Senior Data Scientist,Robert Walters,กรุงเทพมหานคร,"Helping guide data analysts on their paths to becoming data scientists.
Experience with handling large data volumes with modern data processing tools, e.g. by…",Posted5 days ago,,,https://www.indeed.com/rc/clk?jk=a60d753081a52a10&fccid=f01c2f55ec3054bf&vjs=3
Mindshare | Head of Data Intelligence,Mindshare Thailand,กรุงเทพมหานคร,"Manage, support, and grow Data Intelligence team which consists of data engineers and data scientists.
Proficient with SQL, Python or R to manipulate data and…",Posted29 days ago,,,https://www.indeed.com/rc/clk?jk=e3f840b3134612f1&fccid=4614c5fc09ad5cd7&vjs=3
"Machine Learning Engineer, Advanced Analytics",Pandora Jewelry,"ประเวศ, กรุงเทพมหานคร","Build Python packages that will be used by data scientists.
Further to that, you will model data and build tools to be used by data scientist creating ML models…",Posted30+ days ago,,,https://www.indeed.com/rc/clk?jk=c0f0d2902eda21c9&fccid=d52b9b25e32242d5&vjs=3
Quality Assurance Engineer - DataX,ธนาคารไทยพาณิชย์,กรุงเทพมหานคร,"Own the QA data engineering role throughout each project and be responsible for data quality.
Prepare Test data to support test execution on each project (Data…",Posted30+ days ago,,,https://www.indeed.com/rc/clk?jk=2ce371ebaf284f2d&fccid=5de6d81f2151c0f2&vjs=3
Project Manager,AECOM,กรุงเทพมหานคร,"+ 5 - 10 years of experience in managing data center projects (or similar mission critical projects e.g. hospital, airport, industrial projects).",Posted30+ days ago,,,https://www.indeed.com/rc/clk?jk=29bc7cc2b183b8c6&fccid=bafa4b35e9cd20ce&vjs=3
Data Engineering,เบทาโกร,"หลักสี่, กรุงเทพมหานคร","Create data products for analytics and data scientist team members to improve their productivity.
Experience developing and maintaining data warehouses in big…",Posted13 days ago,,,https://www.indeed.com/rc/clk?jk=e2b783d62bc44ffe&fccid=8e4c9e79d871cc42&vjs=3
Data Scientist - Digital Office,SCG,กรุงเทพมหานคร,"Process, clean, and verify the integrity of data used for analysis and provide data preparation algorithm to data engineer in order to implement the project's…",Posted30+ days ago,,,https://www.indeed.com/rc/clk?jk=2183bece4cc6b130&fccid=132b3056152ea260&vjs=3
