job_title,company,location,job_summary,post_date,more_info,salary,job_url
Business Analytics Manager,Ralph Lauren,"Lai Chi Kok, Kowloon","Manage data warehouse ETL processes and BI applications.
Maintain and implement BI and data warehouse platforms.
Investigate and analyse Retail system issues.",Posted30+ days ago,,,https://www.indeed.com/rc/clk?jk=7c5aed6e5aa66cbf&fccid=535de7c767791408&vjs=3
Senior Software Engineer - Machine Learning on telephony and...,VTech Telecommunications Ltd.,Hong Kong,Participate in research on new technologies on audio and video fields for software development of telephony and baby monitor products.,Posted30+ days ago,,,https://www.indeed.com/rc/clk?jk=8e08e986c93a449e&fccid=02c34105adf0726a&vjs=3
Data Scientist - Data & Analytics - Innovation and Data Lab...,Hong Kong Exchange,Hong Kong,"Visualize data and create reports.
Interpret and analyze data problems, and develop and deploy exploratory data analytics models.",Posted30+ days ago,Full-time,,https://www.indeed.com/rc/clk?jk=0973bf01758d03aa&fccid=8a01ef68fc07d03e&vjs=3
"Senior Data Scientist, Asia Pacific",ProJob21.com Ltd,Hong Kong,"Coach junior users on topics such as Tableau dashboard development, data analytics, and data modelling.
Use tools such as Python and Tableau to create and…",Posted17 days ago,,,https://www.indeed.com/rc/clk?jk=89764972563ce0fa&fccid=d2e4a71a4d0c93f2&vjs=3
Post-doctoral Fellow in Developing Deep Learning Method for...,Hong Kong University,"Pok Fu Lam, Hong Kong Island","Department: Department of Diagnostic Radiology, School of Clinical Medicine (20500).
Applications are invited for appointment as Post-doctoral Fellow in…",Posted8 days ago,Full-time,,https://www.indeed.com/rc/clk?jk=1df5336a8f0f5a20&fccid=4101b27de861d291&vjs=3
AI Engineer,Eye Catching Limited,New Territories,"Work closely with front end developer to deploy data services to production environments.
On-going testing and performance optimization for our flagship…",Posted30+ days ago,Full-time,,https://www.indeed.com/rc/clk?jk=8d2bd86b85da76bd&fccid=c34613f80d12b838&vjs=3
Big Data Engineer,Hays,Hong Kong,"Work closely with data science team to ensure the data is prepared for data modelling.
Automate ETL process from data collection to data lake storage and pre…",Posted30+ days ago,,,https://www.indeed.com/rc/clk?jk=8c42455d71e23e43&fccid=31670bef3ae6497b&vjs=3
"Manager, Business Analytics",FWD Insurance,Hong Kong,"Possess proficiency in data management and information usage.
Formulate the business plan with necessary data analysis for senior management review.",Posted30+ days ago,Full-time,,https://www.indeed.com/rc/clk?jk=c1140ea914601be1&fccid=b6615eee465292e9&vjs=3
HKU Professoriate Cluster Recruitment (Data Science and/or B...,Hong Kong University,"Pok Fu Lam, Hong Kong Island",The University of Hong Kong (HKU) is recruiting 30 outstanding academics in data science and/or big data related fields with potential for scientific and…,Posted30+ days ago,Full-time,,https://www.indeed.com/rc/clk?jk=05b48b049603b06b&fccid=4101b27de861d291&vjs=3
Machine Learning Engineer x 1,Pacific Careers,Hong Kong,"O Configuration / development knowledge Machine learning/AI in MS Azure.
Knowledge of machine learning and experience of implementing relevant tools.",Posted30+ days ago,"$52,000 a month","$52,000 a month",https://www.indeed.com/rc/clk?jk=23a47def40eaad78&fccid=8aa104e7f8db0cd3&vjs=3
Junior Programmer (Machine Learning / AI / Fresh Graduate We...,Persolkelly,Hong Kong,"Exposure in clinical data machine learning would be a advantage.
Responsible for development on Python and machine learning projects.",Posted10 days ago,,,https://www.indeed.com/rc/clk?jk=ee71f6549589e49b&fccid=8ec5dcef1e43798c&vjs=3
"Associate Director, Analytics Business Partner",AIA,Hong Kong,"Ensure data best practices and be a thought leader in building a data informed culture.
Taking ownership of analytics solutions and position yourself as a go-to…",Posted30+ days ago,Full-time,,https://www.indeed.com/rc/clk?jk=37047308c4545b1e&fccid=004041685e219574&vjs=3
Assistant Data Analytics Manager,Infotech Services,"North Point, Hong Kong Island","Design data acquisition flow to ensure data quality and other management functions;
2 years or above app/web analytics, data measurement and analytics, and / or…",Posted30+ days ago,"$30,000 - $40,000 a month","$30,000 - $40,000 a month",https://www.indeed.com/rc/clk?jk=5bec56f5bcd328fe&fccid=e2c2b95d8a917e45&vjs=3
Senior Data Modeller,Hays,Hong Kong,"Experienced in data warehouse, data lake and enterprise big data platforms in complex data structures.
Plan, execute, and monitor the development of data models…",Posted30+ days ago,,,https://www.indeed.com/rc/clk?jk=1b2b106355f34164&fccid=31670bef3ae6497b&vjs=3
Machine Learning Specialist x 1,Pacific Careers,Hong Kong," Perform data management and analytics tasks in data warehouse.
 Research and Development of Machine Learning solutions.",PostedPosted 30+ days ago,"$30,000 - $45,000 a month","$30,000 - $45,000 a month",https://www.indeed.com/rc/clk?jk=dd415f88390a52ee&fccid=8aa104e7f8db0cd3&vjs=3
Post-doctoral Fellow in Artificial Intelligence and Deep Lea...,Hong Kong University,"Pok Fu Lam, Hong Kong Island",They should have a good command of written and spoken English and Chinese; strong organizational skills; and proficiency in working on statistical software and…,PostedPosted 30+ days ago,Full-time,,https://www.indeed.com/rc/clk?jk=faa9b3cc4d42a0cb&fccid=4101b27de861d291&vjs=3
Senior Data Science & Analytics Consultant,Morgan McKinley,Hong Kong,"3-6 years of practical experience in data science and analytics.
You will apply a combination of statistical analysis, machine learning, predictive modelling,…",PostedPosted 30+ days ago,"$51,000 - $60,000 a month","$51,000 - $60,000 a month",https://www.indeed.com/rc/clk?jk=1071f05146244787&fccid=893f9f3cd9fe4472&vjs=3
Machine Learning Engineer,Prevision Technology Limited,New Territories,"Software development, e.g. data prepare tools, SDK, testing tools, etc.
Reading papers and implement the algorithms for R&D.",PostedPosted 30+ days ago,"$30,000 - $40,000 a month","$30,000 - $40,000 a month",https://www.indeed.com/rc/clk?jk=26b02e008ff1d298&fccid=af9ea610243d26d4&vjs=3
"Senior Analyst, Data Science - HK Listed Company (Ref: 20222...","AEON Credit Service (Asia) Co., Ltd. (AEON 信貸財務...",Hong Kong,"Lead data analyst team to achieve company data strategy.
Drive continuous improvement in data quality and analytic tools.
Staff purchase discount in AEON group.",PostedPosted 3 days ago,Full-time,,https://www.indeed.com/rc/clk?jk=ccc52dd8ab043b01&fccid=928832a79742afbc&vjs=3
Data Science Analyst – US Digital Acquisition and Engagement...,Cigna,"Kwun Tong, Kowloon","Work with Data Engineering to keep abreast of data ingestion and data enrichment including first and third party data.
Knowledge and experience in Python.",PostedPosted 30+ days ago,Full-time,,https://www.indeed.com/rc/clk?jk=81ac091cd7b701ca&fccid=afbf8c270610a38a&vjs=3
Statistical Programmer (at the rank/grade of Technical Offic...,Hong Kong University,"Pok Fu Lam, Hong Kong Island",The appointee will work with a team of biostatisticians and data management specialists in performing duties on statistical/database programming and database…,PostedPosted 15 days ago,Full-time,,https://www.indeed.com/rc/clk?jk=fcd90708f5f68e08&fccid=4101b27de861d291&vjs=3
Data Science Engineer - Optimisation - Innovation & Data Lab...,Hong Kong Exchange,Hong Kong,"Engaging with data stewards, producers and consumers to design, implement and maintain appropriate data pipelines for production use cases.",PostedPosted 25 days ago,Full-time,,https://www.indeed.com/rc/clk?jk=fa1866c525004dfd&fccid=8a01ef68fc07d03e&vjs=3
Post-doctoral Fellow,Hong Kong University,"Pok Fu Lam, Hong Kong Island","They should have a research background in complex networks, complex systems, urban data science, Bayesian inference, or statistical/theoretical/computational…",PostedPosted 30 days ago,Full-time,,https://www.indeed.com/rc/clk?jk=568208010ed2546b&fccid=4101b27de861d291&vjs=3
Post-doctoral Fellow in Applied Data Science,Hong Kong University,"Pok Fu Lam, Hong Kong Island","The appointee will conduct research in the group of Dr. Huang Yuanhua (https://statbiomed.github.io) under the theme of applied data science, in conjunction…",PostedPosted 30 days ago,Full-time,,https://www.indeed.com/rc/clk?jk=442cac00ad739a9f&fccid=4101b27de861d291&vjs=3
"Assistant Manager, Fraud Analytics - Wealth & Personal Banki...",HSBC,"Central, Hong Kong Island","Support Develop, deploy and optimize fraud detection strategies for various products such as card and digital payments in Retail banking in accordance with the…",PostedPosted 17 days ago,Full-time,,https://www.indeed.com/rc/clk?jk=d44917cd01eb7851&fccid=04c9b139c84ea1b5&vjs=3
Associate – Audit Analytics (2022 Intake),BDO,Hong Kong,"You are responsible to identify and examine IT control deficiency which will induce the audit risk in the risk assessment process, design and execute…",PostedPosted 10 days ago,,,https://www.indeed.com/rc/clk?jk=f662fc917316be9a&fccid=3639654bd4055c70&vjs=3
"Senior Manager, Data Science",Worldwide Consulting Group,Hong Kong,"Evaluate new and existing big data tools to derive and develop new data attributes/features for modeling.
Strong knowledge on data management and analyst.",PostedPosted 30+ days ago,,,https://www.indeed.com/rc/clk?jk=af16f0ce3fbe298c&fccid=32ad20bd5f1f6376&vjs=3
Head of Data Scientist or Director,KOS International Limited,Hong Kong,"A leader in Data Science- have been a data scientist and have built group level data science teams.
Experience in working with large data sets and strong…",PostedPosted 27 days ago,,,https://www.indeed.com/rc/clk?jk=7b665f11b95c5d7f&fccid=aa207b9300cdbd0f&vjs=3
Assistant Manager - Data Science,Hays,Remote in Hong Kong,"Experience in leading data science projects.
Be the technical data expertise in the team on model advising, with great flexibility on implementing state-of-the…",PostedPosted 30+ days ago,,,https://www.indeed.com/rc/clk?jk=a32572a3c99bf1d0&fccid=31670bef3ae6497b&vjs=3
Senior Data Engineer (Data Analytics),Emperor Financial Services Group,Hong Kong,"Solid experience in data modelling for globally scaled data warehouses and data lakes.
Design and implement global data lake and data warehouse platform on…",Posted11 days ago,Full-time,,https://www.indeed.com/rc/clk?jk=be39e5a81965a4b6&fccid=2b3001fa4b294c9e&vjs=3
Data Engineer (AI/ Machine Learning/ RPA),Deepsite Limited,New Territories,"Technical expertise with data models, data mining, and segmentation techniques.
Analyze and organize raw data.
Build data systems and pipelines.",Posted30+ days ago,"$15,000 - $20,000 a month","$15,000 - $20,000 a month",https://www.indeed.com/rc/clk?jk=44ff4fc208e1d1fe&fccid=fa99a309ccbd42d0&vjs=3
Machine Learning Specialist,Infotech Services,"North Point, Hong Kong Island","Perform data management and analytics tasks in data warehouse;
Research and Development of Machine Learning solutions;",Posted30+ days ago,"$30,000 - $45,000 a month","$30,000 - $45,000 a month",https://www.indeed.com/rc/clk?jk=ecbe4548b5682c6a&fccid=e2c2b95d8a917e45&vjs=3
"Machine Learning Engineer (Insurance, stable working environ...",PERSOLKELLY Hong Kong Limited,Hong Kong,"Develop processes and tools to monitor and analyze model performance and data accuracy.
Perform statistical analysis, data mining and machine learning modelling…",Posted19 days ago,,,https://www.indeed.com/rc/clk?jk=00fb79c043cad47c&fccid=8ec5dcef1e43798c&vjs=3
Senior AI Manager,Salt Recruitment,Hong Kong,"Participate in data lake or other data pipeline building projects.
Establish the best practice for data science workflows and MLOps.",Posted30+ days ago,,,https://www.indeed.com/rc/clk?jk=aa038b7b33e0ac25&fccid=d35f6b081e467c24&vjs=3
GAMMA AI Software Engineer,Boston Consulting Group,Hong Kong,"Familiarity with data science methods and scaling data science methods.
Design data structures and visualization of results to provide users actionable…",Posted30+ days ago,,,https://www.indeed.com/rc/clk?jk=16d8571bdb6d2117&fccid=b95f9eb47968fa13&vjs=3
"Director, Data Analytics",Hays,Hong Kong,"Familiar with leveraging big data platform, data lake, or cloud solution for conducing the analysis/ model development.",Posted22 days ago,,,https://www.indeed.com/rc/clk?jk=2f26c7da2f9f6c94&fccid=31670bef3ae6497b&vjs=3
Data Science Senior Manager,Hays,Hong Kong,"4+ years of relevant working experience in data analytics field as statistician / analyst / data scientist.
Ability to perform the big data analytics processes…",Posted30+ days ago,,,https://www.indeed.com/rc/clk?jk=4779bcf8420b3bc9&fccid=31670bef3ae6497b&vjs=3
"Anti-Financial Crime, Modelling and Analytics Specialist, As...",Deutsche Bank,Hong Kong,"Working knowledge in data science, big data tools and infrastructural components – Hadoop / PySpark / Jupyter.
Competitive Salary and non-contributory pension.",Posted30+ days ago,,,https://www.indeed.com/rc/clk?jk=ce0930092ea36ead&fccid=f1d8e147024abb3f&vjs=3
Machine Learning Engineer,Compagnie d'Investissements et de Gestion Privée,Hong Kong,"We are looking for a Research Engineer in our Hong Kong office, starting as soon as possible for 6 months as an intern (with the possibility to be converted…",Posted10 days ago,Full-time,,https://www.indeed.com/rc/clk?jk=937eb33a2a7772d7&fccid=dd616958bd9ddc12&vjs=3
CRM Database Analytic Manager/Data Scientist Circa HK$800Kp....,AGS Group,Hong Kong Island,"Minimum of 6 years in data science, modeling of data science, analytics or data management.
Good command in using data management tools, data systems or related…",Posted30+ days ago,Full-time,,https://www.indeed.com/rc/clk?jk=241570ae45ce713a&fccid=4ccd838571aa1613&vjs=3
"Postdoctoral Fellow, Department of Computing and Decision Sc...",Lingnan University,Hong Kong,"Ideally, the candidate would have experience in applying data science and artificial intelligence in real life contexts.",Posted30+ days ago,,,https://www.indeed.com/rc/clk?jk=0b0a498804b11167&fccid=e62204a28cd57825&vjs=3
Data Analyst (in the grade of Post-doctoral Fellow/Senior Re...,Hong Kong University,"Pok Fu Lam, Hong Kong Island",The appointee will investigate the molecular mechanisms of acute illness and injury using a variety of molecular and medical data.,Posted30+ days ago,Full-time,,https://www.indeed.com/rc/clk?jk=e076d31f161b108e&fccid=4101b27de861d291&vjs=3
Business Intelligence Manager,Hays,Hong Kong,"Experienced in big data, data lake, data dictionary.
Lead data team for project management in BI and data projects with internal and external users.",Posted30+ days ago,,,https://www.indeed.com/rc/clk?jk=a21aba20a498e146&fccid=31670bef3ae6497b&vjs=3
"Development Lead (AI, Machine Learning & Computer Vision)",Peoplebank,Hong Kong,Our client is a sports services specialist most renowned for using VR technologies on sport training and they especially work closely with NBA professionals on…,Posted29 days ago,,,https://www.indeed.com/rc/clk?jk=7e2f3593b2c6a007&fccid=c90e910978217fed&vjs=3
Senior Research Assistant/Research Assistant I/II in Big Dat...,Laboratory of Data Discovery for Health Limited,New Territories,"Applicants should possess a Bachelor’s degree or above in Computer Science, Software Engineering, Data Science, or other related disciplines, with relevant…",Posted16 days ago,Full-time,,https://www.indeed.com/rc/clk?jk=e81ce7544bfc7f52&fccid=a6ec7f6a87bffa4c&vjs=3
Computer Vision Engineer,Hays,Hong Kong,"Perform R&D in Deep Learning, Machine Learning, or computer vision algorithms.
Research the latest technologies in Deep Learning / Machine Learning and identify…",Posted30+ days ago,,,https://www.indeed.com/rc/clk?jk=dc13ce3e2dab57fb&fccid=31670bef3ae6497b&vjs=3
Manager Data and Analytics - Wealth and Personal Banking,HSBC,"Kowloon City, Kowloon","Experience in one or more of: customer segmentation, digital marketing, data science, portfolio analytics, use of open-source data in analyses.",Posted18 days ago,Full-time,,https://www.indeed.com/rc/clk?jk=181b00d4f44bf5bf&fccid=04c9b139c84ea1b5&vjs=3
Director of Data Analytics - Insurance,Morgan McKinley,Hong Kong,"Solid knowledge of modern data infrastructure including data warehouse, data lake and respective applications.",Posted11 days ago,,,https://www.indeed.com/rc/clk?jk=b8993a7b0d72f336&fccid=893f9f3cd9fe4472&vjs=3
ODDA Global Director for Product Strategy and Analytics Solu...,MARS,Hong Kong,"Analyze large and complex data sources such as Nielsen and SAP.
Experience in the China market with an understanding of the data space.",Posted26 days ago,Full-time,,https://www.indeed.com/rc/clk?jk=c705b8ac8e7574ea&fccid=6f49e88f14c18b75&vjs=3
System Analyst (Business Intelligence),Hays,Hong Kong,"5+ years of experience in data warehouse / data lake / BI development (Power BI).
Provide system support services for data analytics tools.",Posted26 days ago,,,https://www.indeed.com/rc/clk?jk=d700eb5232f02811&fccid=31670bef3ae6497b&vjs=3
AI-Cloud Software Programmer/Specialist,Laboratory of Data Discovery for Health Limited,New Territories,"Big data and AI analytic skill is a plus.
1+ year experience as a software engineer/architect designing, implementing, and optimizing cloud services or web…",Posted16 days ago,Full-time,,https://www.indeed.com/rc/clk?jk=c8ec243d9a97939c&fccid=a6ec7f6a87bffa4c&vjs=3
Engineer – Artificial Intelligence and Machine Learning,Recolo Limited,Hong Kong,"Bachelor Degree in AI, Machine Learning, Computer Science or equivalent.
Experience of MongoDB, Redis and MySQL etc.",Posted30+ days ago,"$390,000 - $455,000 a year","$390,000 - $455,000 a year",https://www.indeed.com/rc/clk?jk=22b0972d091bc3d9&fccid=0354b0360fb21850&vjs=3
"Assistant Manager, Business Analytics",Mannings 萬寧,"Quarry Bay, Hong Kong Island","Provide complete, accurate and timely management reporting and business insights to senior management.
Support in conducting weekly / monthly business reviews…",Posted30+ days ago,Full-time,,https://www.indeed.com/rc/clk?jk=5ed6d8a0aa0c6678&fccid=f837a6ba8aa6bdc1&vjs=3
VP / AVP / Senior Manager - Advanced Analytics (Retail Banki...,Robert Walters,Hong Kong,"Possesses 5 years' experience relating to data analytics, data mining, statistical modeling, predictive analytics, next to buy model, machine learning or data…",Posted24 days ago,,,https://www.indeed.com/rc/clk?jk=bf1b9528c5799104&fccid=f01c2f55ec3054bf&vjs=3
Business Analytics & Planning Manager - Life Insurance,Morgan McKinley,Hong Kong,"Possess proficiency in data management and information usage.
Formulate the business plan with necessary data analysis for senior management review.",Posted30+ days ago,,,https://www.indeed.com/rc/clk?jk=9c4108493255d51b&fccid=893f9f3cd9fe4472&vjs=3
Software Developer/ Web Developer/ Machine Learning Engineer,Peoplebank,"Kwun Tong, Kowloon","To be responsible for design, development, implementation, testing, and enhancement of web.
Assist in analyse user requirements.",Posted18 days ago,,,https://www.indeed.com/rc/clk?jk=17f471571b3e0842&fccid=c90e910978217fed&vjs=3
Data Scientist / Junior Data Scientist,Advance Learning Limited,Hong Kong Island,"Generate and synchronize data with the other mathematical models.
Analyze and preprocess offline mock and online question data.",Posted15 days ago,"$25,000 - $38,000 a month","$25,000 - $38,000 a month",https://www.indeed.com/company/Advance-Learning-Limited/jobs/Data-Scientist-5acd91f4aa802ee3?fccid=a062235636e24143&vjs=3
Data Analytics,Real Messenger,"Remote in Central, Hong Kong Island","Providing technical expertise in data storage structures, data mining, and data cleansing.
Ensure we collect the right data sets, create a new data framework to…",Posted1 day ago,"$20,000 - $30,000 a month","$20,000 - $30,000 a month",https://www.indeed.com/company/Real-Messenger/jobs/Data-Analytic-ebf17e762470d8e0?fccid=8e1edceb021f975b&vjs=3
Data Scientist,South China Morning Post,Hong Kong,Enhance data collection processes to include data from 1st and 3rd party systems relevant for developing analytics systems.,PostedPosted 30+ days ago,Full-time,,https://www.indeed.com/rc/clk?jk=c972524fbd2e60e7&fccid=7205cf60d362cea1&vjs=3
"Junior Data Scientist, i-Bank Fintech Firm, +$420K HKD Annua...",Silicon Valley Associates Recruitment,Hong Kong,"Work and manage the development and maintenance of the AI software projects and implementations of their systems and solutions.
Up to 420K HKD Annual.",PostedPosted 29 days ago,"$420,000 a year","$420,000 a year",https://www.indeed.com/company/Silicon-Valley-Associates-Recruitment/jobs/Junior-Data-Scientist-485241247e603cd5?fccid=ba2fbc75bffcc625&vjs=3
Data Scientist,Super Cat Technology Limited,"Kowloon Bay, Kowloon","Develop processes and tools to monitor and analyze model performance and data accuracy.
Design and develop advanced algorithms and predictive models to achieve…",PostedPosted 1 day ago,"$20,000 a month","$20,000 a month",https://www.indeed.com/company/Conard-International-(Hong-Kong)-Limited/jobs/Data-Scientist-8c57500b9e9bf1ff?fccid=5e9411e8e4dc0e7b&vjs=3
"Data Scientists & AI Developers Interns – Hong Kong, Intact...",Intact,Hong Kong,"Transform data into meaningful conclusions and recommendations.
Please note that for positions with access to financial data or funds, your credit must be in…",PostedPosted 30+ days ago,Full-time +1,,https://www.indeed.com/rc/clk?jk=7aba0b330dc83b9c&fccid=a614b30520ebe6c9&vjs=3
Entry Data Scientist - Hong Kong,ELEVATE,"Quarry Bay, Hong Kong Island","Interest in sustainability and working on impactful data-driven solutions.
Ideate and design the evolution of analytical products or services leveraging access…",PostedPosted 2 days ago,Full-time,,https://www.indeed.com/rc/clk?jk=a05dfb3bfad6e64a&fccid=af1cddf54cb21355&vjs=3
Junior Data Scientist,Hutchison Travel Limited (hutchgo.com),"Hung Hom, Kowloon","Passionate about new technologies and data analysis.
Build reports and visualizations to present data, generate insights from disparate sources of data,…",PostedPosted 30+ days ago,,,https://www.indeed.com/rc/clk?jk=8f89ced55de33842&fccid=c604b374adac7e5f&vjs=3
Machine Learning Engineer,Coherent,Hong Kong,"Working with data in R or Python.
Frequent analytical tasks on various client data, attached visualization.
Data visualization, a great sense on how to present…",PostedPosted 30+ days ago,Full-time,,https://www.indeed.com/rc/clk?jk=07f2bf1e5a5ea9ca&fccid=9e62acb63e905b27&vjs=3
Data Scientist Software Engineer,建順資訊科技(香港)有限公司,"Lai Chi Kok, Kowloon","Develop, implement and maintain quality, scalable and high-performing real time task scheduling and dispatch applications; from conception right through to…",PostedPosted 10 days ago,,,https://www.indeed.com/company/Kin-Shun-Information-Technology-Limited/jobs/Data-Scientist-Software-Engineer-76a98111e63f8d25?fccid=a68c1613df528526&vjs=3
Data Scientist (Remote Possible),Glints,Remote in Hong Kong,"Experience in data mining to creatively identify features from our dataset.
Relevant experience working with recommendation models or algorithms.",PostedPosted 30+ days ago,Full-time,,https://www.indeed.com/rc/clk?jk=ad80546a5f6a95f9&fccid=d1fae73a5e8f26e2&vjs=3
Graduate Machine Learning Engineer 2022-2023,Sapientia Technologies Limited,Hong Kong,Personal data provided will be used strictly in accordance with the relevant data protection law of Hong Kong Special Administrative Region.,PostedPosted 30+ days ago,Full-time,,https://www.indeed.com/rc/clk?jk=1e70c60e13684aaf&fccid=524500af917b4279&vjs=3
Junior Data Scientist - Hong Kong/Shenzhen,ELEVATE,"Quarry Bay, Hong Kong Island","Interest in sustainability and working on impactful data-driven solutions.
Ideate and design the evolution of analytical products or services leveraging access…",PostedPosted 30+ days ago,Full-time,,https://www.indeed.com/rc/clk?jk=c0c43d44123c8a8a&fccid=af1cddf54cb21355&vjs=3
Data Science / Machine Learning Trainee,CargoSmart Limited,"Sha Tin, New Territories","Understand business intelligent and data analyst is an advantage.
Develop business and data analytics skills associated with solution development.",PostedPosted 30+ days ago,,,https://www.indeed.com/rc/clk?jk=b854eadf08bf4df2&fccid=aa01596dcc430edf&vjs=3
Apoidea - Senior Data Scientist,Apoidea Group,Hong Kong,"Design a machine learning system that learns from new data without forgetting the old one.
Review of research paper to identify the most suitable methodology.",PostedPosted 30+ days ago,Full-time,,https://www.indeed.com/rc/clk?jk=c08416c4ae5533ce&fccid=777385c3a9efe51f&vjs=3
IT Jobs in Natural Language Processing,Chilin (HK) Ltd,"Yau Ma Tei, Kowloon",Software Engineers with Systems Administration experience are sought to support expanding AI projects with Natural Language Processing (NLP).,PostedPosted 2 days ago,"$18,000 - $60,000 a month","$18,000 - $60,000 a month",https://www.indeed.com/company/Chilin-(HK)-Ltd/jobs/IT-Natural-Language-Processing-c73da3ffcc0d73e8?fccid=fccaf1d84f4070f4&vjs=3
Machine Learning Engineer,Spotless Tech Limited,"Cyberport, Hong Kong Island","Basic understanding of probability, statistics, optimization, data structure and algorithms.
Research and develop AI/ML solutions that have real impact on the…",EmployerActive 21 days ago,"$16,000 - $18,000 a month","$16,000 - $18,000 a month",https://www.indeed.com/company/Spotless-Tech-Limited/jobs/Machine-Learning-Engineer-34b70a038fc91d19?fccid=e5de66de39f93e13&vjs=3
