job_title,company,location,job_summary,post_date,more_info,salary,job_url
Senior Consultant - Data Science & Analytics,Sia Partners,"Wan Chai, Hong Kong Island","Use your data analytics and data science expertise to derive valuable insights from datasets, build predictive models and machine-learning algorithms.",Posted30+ days ago,Full-time,,https://www.indeed.com/rc/clk?jk=fc75a1d8613c4bc2&fccid=4b32d0c68d487097&vjs=3
"Intern, Analytics - Hong Kong",ELEVATE,"Quarry Bay, Hong Kong Island","Support data tagging and tracking for machine learning outputs.
Hands-on experience in applied data science and Python’s core data science libraries including,…",Posted18 days ago,Internship,,https://www.indeed.com/rc/clk?jk=dfa8d21dfd579e24&fccid=af1cddf54cb21355&vjs=3
Senior Data Scientist (Hong Kong),Lynx Analytics,Hong Kong,"6+ years of overall experience in data mining and/or data science field.
She/he should be comfortable working with very large data sets residing in different…",Posted30+ days ago,,,https://www.indeed.com/rc/clk?jk=8f8c1ed7fee38dc5&fccid=91c660a3af90b17c&vjs=3
Apoidea - Machine Learning Engineer,Apoidea Group,Hong Kong,"Convert a prototype into a scalable machine learning system;
Profile a machine learning system and optimise latency, which includes request batching, model…",Posted30+ days ago,Full-time,,https://www.indeed.com/rc/clk?jk=46865bc0dd791250&fccid=777385c3a9efe51f&vjs=3
Deep Learning Engineer,Gravity Link International,Kowloon,"5、Proficient in C++/Python, familiar with Linux working environment, have a profound understanding of data structure and algorithm design;",Posted30+ days ago,,,https://www.indeed.com/rc/clk?jk=810f4b75ad73c719&fccid=f37a2b2937b5d7f5&vjs=3
Lead Data Scientist,Inspectorio,Hong Kong,"At least 3-5 years of experience on implementing data science projects.
Inspectorio is a cloud-based SaaS solution focused on creating a dynamic and risk…",Posted5 days ago,Full-time,,https://www.indeed.com/rc/clk?jk=4f5b407155b8cb29&fccid=b36b290781136055&vjs=3
Engineer (Machine learning – Vision) (Ref CLR2022-007),TR at CUHK,"Sha Tin, New Territories","Develop machine-learning software for industrial vision applications.
Research state-of-the-art machine-vision algorithms.
14 days of annual leaves.",EmployerActive 16 days ago,Full-time,,https://www.indeed.com/company/TR-at-CUHK/jobs/Engineer-043db90b2b77303a?fccid=703573c7c72f70de&vjs=3
Data Scientist (HK$60K - $80K),Global Executive Consultants,Hong Kong,"Participate in AI and data analytic projects and vendor management.
Coach and share machine learning and data model management with the team.",Posted1 day ago,,,https://www.indeed.com/rc/clk?jk=8f300962bb46968c&fccid=76e131b9803c9734&vjs=3
Senior ESG Data Scientist - Hong Kong,ELEVATE,"Quarry Bay, Hong Kong Island","We are looking for a senior and experienced data scientist with a deep interest in sustainability and supply chains.
Strong knowledge of GCP or AWS platforms.",Posted30+ days ago,Full-time,,https://www.indeed.com/rc/clk?jk=2658f71fa8361077&fccid=af1cddf54cb21355&vjs=3
Computer Vision / Data Sciense Engineer (Software Developer)...,idNerd Studio Ltd.,"Lai Chi Kok, Kowloon","Responsible for developing software to analyze real-time video data using Computer Vision.
Computer Vision / Data Science Engineer (Software Developer).",Posted30+ days ago,Full-time,,https://www.indeed.com/rc/clk?jk=2844e0b30de21682&fccid=24c43bbf8377ed17&vjs=3
Senior Data Scientist,CXC Global,Hong Kong,"Experience in handling unstructured data and structured data with large, complex and multiple data sets from various sources.",Posted30+ days ago,,,https://www.indeed.com/rc/clk?jk=937a3ddc44ddf5d2&fccid=26a53aef7bcac90f&vjs=3
DevOps Engineer for Machine Learning Product (f/m/d),KM.ON,Hong Kong,"Have knowledge of monitoring tools, such as data aggregation and performance metrics (datadog, Prometheus, etc.).
Contribute to our new corporate start-up DNA.",Posted30+ days ago,,,https://www.indeed.com/rc/clk?jk=88c4cdaf16c4290c&fccid=eac5c4e607b50c17&vjs=3
"Senior Software Developer, AI Projects – Hong Kong – Intact...",Intact,Hong Kong,"Big data or ML/AI experiences.
Experience developing data and machine learning pipelines.
Build high performing and scalable data analytics pipeline for real…",Posted30+ days ago,,,https://www.indeed.com/rc/clk?jk=bfa0ad503c9345bc&fccid=a614b30520ebe6c9&vjs=3
Senior Data Analyst (Data Analytics Projects),Swing Consulting,Hong Kong,"Good understanding of data modelling and data management process.
Participate in data analytics projects for data modelling, solution design and development,…",Posted30+ days ago,,,https://www.indeed.com/rc/clk?jk=2d758b6aa4f0580d&fccid=b6285137c7f32920&vjs=3
"Senior Director, AI for Health Research",CXC Global,Hong Kong,"Strong record of building and managing a portfolio of research and data science projects.
Own scalable projects to ensure the completion of data science and AI…",Posted30+ days ago,,,https://www.indeed.com/rc/clk?jk=4f589a17a5020691&fccid=26a53aef7bcac90f&vjs=3
Associate Marketing Manager - Growth Analytics,foodpanda Hong Kong,Hong Kong,"Minimum 3 years of data analytics experience in high growth start-ups, tech companies, consulting firm.
Having strong analytical skills, with a data-driven and…",PostedPosted 10 days ago,,,https://www.indeed.com/rc/clk?jk=3ab4af4049264658&fccid=8bf6fce5822c5030&vjs=3
"Senior Full-Stack Developer - eCommerce, Data Science and Ma...",Silicon Valley Associates Recruitment,Hong Kong,"Also, would work a lot on data and analytics projects.
They have worked with many famous MNCs.
After very successful 2021 and new projects, they are ooking for…",Hiring ongoing,"$500,000 - $528,000 a year","$500,000 - $528,000 a year",https://www.indeed.com/company/Silicon-Valley-Associates-Recruitment/jobs/Senior-Full-Stack-Developer-8723d04702679124?fccid=ba2fbc75bffcc625&vjs=3
AI System Architect/ System Analyst/ Analyst Programmer/ Dat...,Global Executive Consultants,Hong Kong,"Explore and visualize the data with algorithms to address the business models.
Our client is seeking tech-savvy team players with keen knowledge and interest in…",PostedPosted 30+ days ago,,,https://www.indeed.com/rc/clk?jk=812357041f28dabe&fccid=76e131b9803c9734&vjs=3
