job_title,company,location,job_summary,post_date,more_info,salary,job_url
Lead Data Scientist - Data & Analytics - Innovation and Data...,Hong Kong Exchange,Hong Kong,"Interpret and analyze data problems, and conceive, plan and prioritize data projects.
As a Lead Data Scientist, you will act as an internal SME in data science…",PostedPosted 30+ days ago,Full-time,,https://www.indeed.com/rc/clk?jk=8b73ea1c43536f15&fccid=8a01ef68fc07d03e&vjs=3
"Associate Director, Data Science",AIA,Hong Kong,"Develop the framework for analytics across the company – standardization of data collection, data automation, data management, data use and model governance.",PostedPosted 30+ days ago,Full-time,,https://www.indeed.com/rc/clk?jk=0a628a2787621ae1&fccid=004041685e219574&vjs=3
Data Scientist,Arup,Hong Kong,"Develop analytics algorithm and data roadmap.
Get involved in data mining, management and develop analytics model.
Strong analytical and organization skills.",PostedPosted 30+ days ago,,,https://www.indeed.com/rc/clk?jk=dcea5cc5d6612779&fccid=38c0d5e4f2a99768&vjs=3
Machine Learning Developer,GROWTHSPOT,Hong Kong,"Architecting, developing, and maintaining high quality, scalable applications.
Devise new, innovative ways of development for both web and mobile platforms.",PostedPosted 30+ days ago,Full-time,,https://www.indeed.com/rc/clk?jk=e9061a963b033525&fccid=dd616958bd9ddc12&vjs=3
Data Scientist (CI-LJ-25082),aimHigher,Hong Kong,"Build up custom data models and algorithms to apply data sets.
Monitor and analyze model performance and data accuracy.
Ph.D.'s degree is a plus.",PostedPosted 30+ days ago,Full-time,,https://www.indeed.com/rc/clk?jk=a9b68a9dce1952dc&fccid=1befa20071545550&vjs=3
"Data Science, Consultant (Manager grade)",AIA,Hong Kong,"Familiarity with data management tools.
Experiments against data points, provide information based on experiment results and provide previously undiscovered…",PostedPosted 23 days ago,Full-time,,https://www.indeed.com/rc/clk?jk=f24449501eb66135&fccid=004041685e219574&vjs=3
Senior Consultant in Strategy & Data Science - Hong Kong,Ekimetrics,Hong Kong,"+320 consultants, all are also data scientists.
The successful candidate will have a balance of marketing and business strategy understanding, client-facing…",PostedPosted 30+ days ago,Full-time,,https://www.indeed.com/rc/clk?jk=8b841211b4c3d3d7&fccid=3fb68589a69677e6&vjs=3
Product Manager Big Data,A.S. Watson Group,"Fo Tan, New Territories",This role will “own” the solution and lead product strategy and roadmap and work with other big data streams to help build a comprehensive big data product…,PostedPosted 30+ days ago,,,https://www.indeed.com/rc/clk?jk=1252b84265576802&fccid=1f593f8528f0c819&vjs=3
Graduate Data Scientist,Arup,Hong Kong,Advise data driven services to our traditional advisory services in built environment and where applicable for creating technology system architecture to…,PostedPosted 30+ days ago,,,https://www.indeed.com/rc/clk?jk=f20439ce5e8da3ec&fccid=38c0d5e4f2a99768&vjs=3
Head of Data Science & Governance,Worldwide Consulting Group,Hong Kong,"Experience in managing and utilizing large volumes of data, data quality, data governance, data ETL, and data integration tools.",PostedPosted 30+ days ago,,,https://www.indeed.com/rc/clk?jk=e2e6cceccb0c2c46&fccid=32ad20bd5f1f6376&vjs=3
Senior Consultant (AI / Data Analytics) - IC,Classy Wheeler,"Quarry Bay, Hong Kong Island","Drive Data & AI offerings in the market, effectively positioning those offerings with sales teams and target clients.",PostedPosted 30+ days ago,"$30,000 - $50,000 a month","$30,000 - $50,000 a month",https://www.indeed.com/rc/clk?jk=4e8ea58f29b491f2&fccid=7e57982cb894da40&vjs=3
"Director, Head of Data and Customer Analytics",FWD Insurance,Hong Kong,"Solid knowledge of modern data infrastructure including data warehouse, data lake and respective applications.",PostedPosted 30+ days ago,Full-time,,https://www.indeed.com/rc/clk?jk=02a7052e36af7a23&fccid=b6615eee465292e9&vjs=3
Project Manager Big Data,A.S. Watson Group,"Fo Tan, New Territories","Working experience with data analytics and data science is highly preferred.
Work with both technical and business cross functional stakeholders and team…",PostedPosted 25 days ago,,,https://www.indeed.com/rc/clk?jk=d2e7d337e5ac49ba&fccid=1f593f8528f0c819&vjs=3
Research Assistant (Machine Learning and Natural Language Pr...,Sci-Union Technology,Hong Kong,The appointee will help supervise undergraduate students who manually label sentences; clean and maintain the training data set thus created; apply already…,PostedPosted 30+ days ago,,,https://www.indeed.com/rc/clk?jk=17af623be9e633b5&fccid=e14e33274b0a3684&vjs=3
Statistical Analyst (Retail Strategy),Chow Tai Fook,Hong Kong,"Manipulate, consolidate, and transform data for statistical analyses and modeling• Suggest the appropriate analytical methodology for day-to-day analytical…",Posted30+ days ago,,,https://www.indeed.com/rc/clk?jk=8765d4f0438b274f&fccid=401e489d266b61b5&vjs=3
Technical Manager/Assistant Technical Manager/Senior Technic...,Hong Kong University,"Pok Fu Lam, Hong Kong Island","They should have a strong quantitative background; experience in analysing epidemiological data using R, STATA, SAS or other statistical packages; and…",Posted30+ days ago,Full-time,,https://www.indeed.com/rc/clk?jk=799584007f4a5a59&fccid=4101b27de861d291&vjs=3
Data Engineer (Big Data) (60-70K) (Listed company),Manpower,Hong Kong,"Understand data scientists needs, ensuring we have the data available and stored in the data lake, data is cleaned and prepared for data modelling.",Posted1 day ago,,,https://www.indeed.com/rc/clk?jk=079f2e69585d69c1&fccid=1a17983a910f73d8&vjs=3
Data Analyst (in the grade of Research Assistant II),Hong Kong University,"Pok Fu Lam, Hong Kong Island",The appointee will investigate the molecular mechanisms of acute illness and injury using a variety of molecular and medical data.,Posted30+ days ago,Full-time,,https://www.indeed.com/rc/clk?jk=8118eb5a25dcf1cf&fccid=4101b27de861d291&vjs=3
"Director, Data Analytics",Manulife,Hong Kong,"Experience in using data lake or other platforms that performs on distributed computing.
Fundamental knowledge on data visualization tools (Tableau, QlikView,…",Posted30+ days ago,Full-time,,https://www.indeed.com/rc/clk?jk=e0fbed8243f39ae6&fccid=1747adf6142beb48&vjs=3
Data Science Lead,Sun Hung Kai Properties,Hong Kong,"Minimum 8 years’ experience in data science or related field, a proven track record of managing team with data scientists and data engineers.",Posted30+ days ago,,,https://www.indeed.com/rc/clk?jk=347939e5a1bc4676&fccid=d0c0bf161993feaa&vjs=3
Data Analytics & AI Consulting Manager - IC,Classy Wheeler,"Quarry Bay, Hong Kong Island","Develop the data consulting competency by designing frameworks, tool-kits and accelerators to deliver data strategy, data governance and end to end data…",Posted30+ days ago,"$60,000 - $90,000 a month","$60,000 - $90,000 a month",https://www.indeed.com/rc/clk?jk=ca048765e87be0d5&fccid=7e57982cb894da40&vjs=3
Customer Analytics & Data Science Manager (Campaign),Bank of China (Hong Kong),Hong Kong,Work collaboratively with business user identifying target customer segments and selection criteria for new acquisition/ cross-selling / up-selling/ usage…,Posted30+ days ago,Full-time,,https://www.indeed.com/rc/clk?jk=77e8fc413faed51e&fccid=82a924ef8a1e6217&vjs=3
Software Engineer (Machine Learning),Société Générale,Hong Kong,"Understand users’ requirements and be able to design and propose solutions.
Hands on development for digitization projects and Trade Surveillance project.",Posted30+ days ago,,,https://www.indeed.com/rc/clk?jk=2607a0fb8893e397&fccid=df6948c9b8da6236&vjs=3
Research Assistant / Research Associate (NLP Research),The Hong Kong University of Science and Technology,"Clear Water Bay, New Territories","The ideal candidate should have strong quantitative skills and experience in data cleansing, data manipulation, and analysis; have understanding of NLP…",Posted30+ days ago,,,https://www.indeed.com/rc/clk?jk=860e981697a7cc07&fccid=4650d78f3d4a16d3&vjs=3
Research Associate / Research Assistant (NLP Research),Sci-Union Technology,Hong Kong,"Applicants should (i) have a PhD degree (for Research Associate position), or a master’s or bachelor’s degree (for Research Assistant position) in computer…",Posted30+ days ago,,,https://www.indeed.com/rc/clk?jk=25a10970682f1f79&fccid=e14e33274b0a3684&vjs=3
Consulting - Business Consulting - Data Analytics - Manager...,EY,Hong Kong,"Experience in leading a team of data analysts / data scientists/ data engineers to successful project delivery.
To qualify for the role, you must have.",Posted30+ days ago,,,https://www.indeed.com/rc/clk?jk=bc8a25ebe00584f9&fccid=1544766d4c2915b0&vjs=3
Research Assistants / Research Associates / Post-doctoral Fe...,The Hong Kong University of Science and Technology,"Clear Water Bay, New Territories",Applicants should have a PhD degree (for Research Associate/Post-doctoral Fellow positions) or a master’s degree (for Research Assistant positions) in computer…,Posted30+ days ago,,,https://www.indeed.com/rc/clk?jk=c2ccde07ad799f3d&fccid=4650d78f3d4a16d3&vjs=3
Data Scientist(E-commerce platform),Hays,Hong Kong,Accountable for using data science methods to translate daily business observations and managing the internal application in an effective way.,Posted30+ days ago,,,https://www.indeed.com/rc/clk?jk=65224bafbac7e4be&fccid=31670bef3ae6497b&vjs=3
"TRAINEE: Market Risk, Data Science Analyst",Société Générale,Hong Kong,Research and propose statistical outlier detection methods to identify potential data quality issues across a range of business use cases.,Posted30+ days ago,Full-time,,https://www.indeed.com/rc/clk?jk=d09a271cbb7c9b85&fccid=df6948c9b8da6236&vjs=3
Manager Analytics and Modelling - Hang Seng Bank (HK),HSBC,"Mong Kok, Kowloon","Comfortable with mining massive volume of data for quick insight discovery.
Creatively translate business problems into data science initiatives with…",PostedPosted 15 days ago,Full-time,,https://www.indeed.com/rc/clk?jk=157b58b117dc1fd2&fccid=04c9b139c84ea1b5&vjs=3
Senior Data Scientist,JC Executive Search,"Central, Hong Kong Island","Explore new data sources and data gathering techniques.
Understand the business reality behind large sets of data and develop meaningful analytic solutions.",PostedPosted 30+ days ago,,,https://www.indeed.com/rc/clk?jk=81994ce07f47bb4d&fccid=6ec859e1a41254a6&vjs=3
Data Analyst,Moseswills,Hong Kong,"Assist in any data management tasks such as data structure design, data catalog and data quality management.
Knowledge in Big Data Tools.",PostedPosted 30+ days ago,Full-time,,https://www.indeed.com/rc/clk?jk=e71c9480d64ad722&fccid=5c93ab370ece24d8&vjs=3
AI Engineer,QBS System,"Sha Tin, New Territories","Work with engineers/developers to realize the proposed algorithms in big data environment.
Compose Research Paper for R&D Activities.",PostedPosted 30+ days ago,,,https://www.indeed.com/rc/clk?jk=8a02d204206dea79&fccid=f4a9414a81d89dba&vjs=3
Big Data & AI Platform Architect,Bank of China (Hong Kong),Hong Kong,"Able to communicate effectively with non-IT users for relevant innovation projects surrounding big data and AI arenas.
BDA and AI adoption patterns.",PostedPosted 30+ days ago,Full-time,,https://www.indeed.com/rc/clk?jk=9d43dde113b05b67&fccid=82a924ef8a1e6217&vjs=3
Senior Data Scientist,HKT,Hong Kong,"Lead data scientist team members in the development of new insights, advanced modeling techniques, and data science capabilities.",PostedPosted 30+ days ago,Part-time +1,,https://www.indeed.com/rc/clk?jk=70bb43e1aa9a366a&fccid=527725ca493cadbd&vjs=3
(Senior) Data Scientist / Machine Learning Engineer - Recomm...,"TCL Corporate Research (Hong Kong) Co., Limited",Hong Kong,"We’re seeking a strong data scientist candidate that is comfortable pulling and aggregating data from multiple large sources, building out models, designing…",PostedPosted 9 days ago,Full-time,,https://www.indeed.com/rc/clk?jk=5e18fd60d8b7f387&fccid=c2ff9592b3ffc44f&vjs=3
Data Science Intern (6-month Full-time),Rural Community Insurance Agency Inc,Hong Kong,"Knowledge on analytics and/or some data science techniques preferred e.g. data mining, neural networks, various tree models, classifiers & regressors,…",PostedPosted 24 days ago,Full-time +1,,https://www.indeed.com/rc/clk?jk=36b28c66fa9fa145&fccid=2a435e59084c259c&vjs=3
AI Data Analyst (Ref: CT/AIDA),Build King Holdings Ltd,Hong Kong,"Coordinate centralized data, identify, analyse, and interpret trends or patterns in complex data sets;
Experience in AI construction data analysis is preferable…",PostedPosted 8 days ago,Full-time,,https://www.indeed.com/rc/clk?jk=746c48e66453130c&fccid=f331be9db628d762&vjs=3
Data Architect / Scientist / Warehouse Consultant / Analyst...,Classy Wheeler,"Quarry Bay, Hong Kong Island","Strong competency in building large scale enterprise data pipelines using Data Analytics platforms and applied onto high performing data warehouses, data lakes…",PostedPosted 30+ days ago,"$30,000 - $70,000 a month","$30,000 - $70,000 a month",https://www.indeed.com/rc/clk?jk=2edaef4e09d3afee&fccid=7e57982cb894da40&vjs=3
"Postdoctoral Researcher, AI & Robotics",Hong Kong Productivity Council,Hong Kong,"Creativity in new ideas and future focus vision.
Support implementation of government-funded project in the field of AI & Robotics.",PostedPosted 30+ days ago,,,https://www.indeed.com/rc/clk?jk=966170d863a04101&fccid=623383baa47ee843&vjs=3
Database Analytic Manager/Data Scientist Circa HK$600Kp.a,AGS Group,Hong Kong,"Minimum of 6 years in data science, modeling of data science, analytics or data management.
Good command in using data management tools, data systems or related…",PostedPosted 30+ days ago,Full-time,,https://www.indeed.com/rc/clk?jk=ad267b4e5c4fa2c4&fccid=4ccd838571aa1613&vjs=3
Cloud Solution Architect - Data & AI,Microsoft,"Cyberport, Hong Kong Island+1 location","Expert knowledge and experience in the architecture of enterprise data platform architecture and data lake.
NoSQL platforms (MongoDB, Azure Cosmos DB, etc.) and…",PostedPosted 25 days ago,Full-time,,https://www.indeed.com/rc/clk?jk=3d8274613563c818&fccid=734cb5a01ee60f80&vjs=3
Research Associate / Research Assistant (NLP Research),The Hong Kong University of Science and Technology,"Clear Water Bay, New Territories","Applicants should (i) have a PhD degree (for Research Associate position), or a master’s or bachelor’s degree (for Research Assistant position) in computer…",PostedPosted 30+ days ago,,,https://www.indeed.com/rc/clk?jk=96206e39b13f3237&fccid=4650d78f3d4a16d3&vjs=3
AI Ops Software - Brand Technical Specialist,IBM,Hong Kong,"IBM provides you with the most comprehensive and consistent approach to development, security and operations across hybrid environments—with complete software…",PostedPosted 30+ days ago,Full-time,,https://www.indeed.com/rc/clk?jk=c7267d766db5cf1b&fccid=de71a49b535e21cb&vjs=3
Statistician,CENSUS AND STATISTICS DEPARTMENT,Hong Kong,"(1) A recognised Master or Bachelor’s degree in programmes with substantial contents of Statistics (e.g. programmes on risk management, actuarial science, data…",Posted8 days ago,"$57,395 a month","$57,395 a month",https://www.indeed.com/rc/clk?jk=9e80da2066c15960&fccid=066a6183ab9ba375&vjs=3
Data Analyst (Deep Learning),CGP集团,Hong Kong,"Assist data scientists on feature engineering.
Create machine learning model with senior data scientists.
Build data visualization to show the insight and trend…",Posted8 days ago,,,https://www.indeed.com/rc/clk?jk=ad575d23bf4b6f1d&fccid=30e5ea284209c075&vjs=3
"Data Scientist (Commerce, up to 55k)",Robert Walters,Hong Kong,"Minimal 5 years’ work experience in data science, with proven track record of delivering data science solutions to drive business impact.",Posted12 days ago,,,https://www.indeed.com/rc/clk?jk=f1626af55f4b684e&fccid=f01c2f55ec3054bf&vjs=3
Senior Manager in Data Science Consulting - Hong Kong,Ekimetrics,Hong Kong,"+320consultants, all are also data scientists.
Lead trainings for consultants on topics, from data science techniques through to business strategy.",Posted30+ days ago,Full-time,,https://www.indeed.com/rc/clk?jk=67cffb36564e02b4&fccid=3fb68589a69677e6&vjs=3
Software / ML Engineer,RCLabs,Hong Kong,"Implement and maintain back-end applications for data collection and processing.
2 year+ experience in machine learning / data mining and proficient in cloud…",Posted30+ days ago,,,https://www.indeed.com/rc/clk?jk=184af2a6f0aaaf72&fccid=9d909eb0c91ade5b&vjs=3
"Senior Data Scientist, Asia Pacific",ProJobs21,Hong Kong,"Coach junior users on topics such as Tableau dashboard development, data analytics, and data modelling.
Use tools such as Python and Tableau to create and…",Posted17 days ago,,,https://www.indeed.com/rc/clk?jk=c21de10ae5c91670&fccid=513d7cb4a42e478a&vjs=3
Business Analytics Analyst (BI and Merchandise Applications),Ralph Lauren,"Lai Chi Kok, Kowloon","Provide solutions and support to data warehouse, BI and merchandise applications.
At least 3 years of relevant experience in data warehousing, ETL processes,…",Posted30+ days ago,,,https://www.indeed.com/rc/clk?jk=b25b7156b21fc7a5&fccid=535de7c767791408&vjs=3
"Assistant Manager, Customer Analytics & Data Engineering",Prudential,Hong Kong,"Understand data schema of available data sources.
Design suitable data schema for the data warehouse to enable efficient query and retrieval of data for…",Posted30+ days ago,Part-time +1,,https://www.indeed.com/rc/clk?jk=3a55e73887b02275&fccid=4144c0c6235e4037&vjs=3
Research Assistants / Research Associates / Post-doctoral Fe...,Sci-Union Technology,Hong Kong,Applicants should have a PhD degree (for Research Associate/Post-doctoral Fellow positions) or a master’s degree (for Research Assistant positions) in computer…,Posted30+ days ago,,,https://www.indeed.com/rc/clk?jk=98207d1e8f409e74&fccid=e14e33274b0a3684&vjs=3
"SAINT LAURENT CRM Data Analytics Assistant Manager, Asia Pac...",Groupe Kering,Hong Kong,"Formulate and design data analytics and CRM programs with alignment to business needs, develop data management framework, define digital analytics tracking…",Posted19 days ago,Full-time,,https://www.indeed.com/rc/clk?jk=4ad3ca36220672cc&fccid=2c1ebe710125ee82&vjs=3
Summer Intern – Machine Learning Graphics Intern,Tech Hill,"Sha Tin, New Territories","Create and organize data such that it can be archived and reused by team members.
Implement research and share your findings with the team.",Posted30+ days ago,Full-time +1,,https://www.indeed.com/rc/clk?jk=81c4a8ab6b6c0c9d&fccid=6c38301e5b6549d6&vjs=3
clerk (welcome fresh grad. in Data Science / Statistics) - w...,AA Choice Personnel Consultancy Limited,Hong Kong,"Process and cleanse data for analysis.
Good sense on numbers and data handling an advantage.
Provide operational support to the project related to data…",Posted15 days ago,,,https://www.indeed.com/rc/clk?jk=a3ad015d2e1e79d8&fccid=dcaec38433ac2a9f&vjs=3
"AVP - Data Translator, Business Planning & Analytics, Corpor...",DBS Bank,Hong Kong,"Explore data sources and conduct exploratory data analysis.
Collaborate with data scientists and data engineers to develop data science solutions, ranging from…",Posted10 days ago,Full-time,,https://www.indeed.com/rc/clk?jk=d0b5b47210fc086d&fccid=cc1f9ea511d140fe&vjs=3
"AVP, Team Head, Customer Insights & Data Analytics",DBS Bank,Hong Kong,"Work with business units and Business Analytics team to implement data strategies, build data flows, develop conceptual/logical/physical data models, and…",Posted30+ days ago,Full-time,,https://www.indeed.com/rc/clk?jk=bde622e056fe9009&fccid=cc1f9ea511d140fe&vjs=3
"Field Sales Manager, Data and Analytics, Google Cloud",Google,Hong Kong,"Excellent business judgment and analytics skills, using data to inform decisions and influence stakeholders.
7 years of experience managing a team of sellers.",Posted30+ days ago,Full-time,,https://www.indeed.com/rc/clk?jk=bed05a5dd8c0142f&fccid=a5b4499d9e91a5c6&vjs=3
Consulting - Data & Analytics - Senior Data Scientist / Seni...,EY,Hong Kong,"Experience in leading a team of data analysts / data scientists / data engineers to successful project delivery.
To qualify for the role, you must have.",Posted30+ days ago,,,https://www.indeed.com/rc/clk?jk=fb667d04dc9fb187&fccid=1544766d4c2915b0&vjs=3
(Senior) Machine Learning Engineer,A.S. Watson Group,"Fo Tan, New Territories","Developing automated data pipeline with a continuous integration mindset.
Assisting in promoting data culture and best practices within the organization.",Posted23 days ago,,,https://www.indeed.com/rc/clk?jk=3828d94ccc50a88a&fccid=1f593f8528f0c819&vjs=3
"Analyst, Credit Development and Analytics - Wealth Managemen...",BNP Paribas,Hong Kong,"Data science background required - proven abilities in data processing and analysis of large databases.
Handle statistics and data analysis, namely aiming at…",Posted30+ days ago,,,https://www.indeed.com/rc/clk?jk=af11d4c1dc4d5f4d&fccid=1392500f835bba92&vjs=3
"Business Analyst, Data Science",Pacific Century CyberWorks Limited,Hong Kong,"You will join a team of data scientists and data engineers, and 'slice and dice' data using your own methods, creating new visions for the future.",Posted2 days ago,,,https://www.indeed.com/rc/clk?jk=362b04f898580e23&fccid=73c2cfbb3615b7a2&vjs=3
Product Manager / Data Scientist / Data Analyst - IC,Classy Wheeler,"Ngau Tau Kok, Kowloon","Ensure data accuracy and continuously improve data quality.
Develop and implement databases, data collection systems and data analytics.",Posted30+ days ago,"$40,000 - $80,000 a month","$40,000 - $80,000 a month",https://www.indeed.com/rc/clk?jk=fc27fd76db23c481&fccid=7e57982cb894da40&vjs=3
"Assistant Professor, Data Science",Lingnan University,Hong Kong,"With three academic Faculties and the School of Interdisciplinary Studies, it offers a wide range of undergraduate degree programmes in the areas of Arts,…",Posted30+ days ago,Full-time,,https://www.indeed.com/rc/clk?jk=1b5da9363cc316cd&fccid=e62204a28cd57825&vjs=3
Senior Data Architect - Microsoft Analytics & Cloud focus,IBM,Hong Kong,"Preferred experience in collaboration with data scientist in data exploration and machine learning.
Demonstrate capability in data lake, data warehousing, data…",Posted30+ days ago,Full-time,,https://www.indeed.com/rc/clk?jk=aaf3f6a3ca363ef9&fccid=de71a49b535e21cb&vjs=3
Senior Data Analytics Analyst / Senior BI Developer,Classy Wheeler,"Hong Kong Science Park, New Territories","Senior BI / Data Analytics Analyst (Node.JS, Python).
Diploma or above in IT, Statistics, Data Science or related disciplines.",Posted30+ days ago,"$18,000 - $40,000 a month","$18,000 - $40,000 a month",https://www.indeed.com/rc/clk?jk=8fd9d1b0050a7e2b&fccid=7e57982cb894da40&vjs=3
Senior Data Scientist (ML) ~ Multinational Group,KOS International Limited,Hong Kong Island,"Proficient in Python for data processing is required.
Work with internal data team to deploy complex and large amount of data across different channels and…",Posted17 days ago,,,https://www.indeed.com/rc/clk?jk=1b216c69e9ba0ae9&fccid=aa207b9300cdbd0f&vjs=3
"SENIOR ENGINEER / ENGINEER, DEEP LEARNING",UMEC,Hong Kong,"All data provided will be kept in strict confidence and will be used for employment related purpose.
Assist in the execution of R&D project.",Posted30+ days ago,,,https://www.indeed.com/rc/clk?jk=d38126c1ab6fb729&fccid=9703db2e3fc03b3f&vjs=3
ML Engineer,Delvify,Hong Kong,"The role reports to the Head of Development and will also be working closely with the Product Manager.
Knowledge on Python programming and concept of OOP.",Posted30+ days ago,,,https://www.indeed.com/rc/clk?jk=917dfb70ae6e0d86&fccid=1d4b82cc21d61757&vjs=3
"Data Science Consultant (MNC, Fresh Grad - Senior)",Randstad,Hong Kong,"Gathering and analyzing data, building statistical models and translating them into strategic recommendations.
Experience in Python/ R/ SQL.",Posted30+ days ago,"$22,000 - $35,000 a month","$22,000 - $35,000 a month",https://www.indeed.com/rc/clk?jk=2626961adb821907&fccid=f8b265243da9f9d7&vjs=3
Assistant Data Analytics Manager x 1,Pacific Careers,Hong Kong," Design data acquisition flow to ensure data quality and other management functions.
 Work with stakeholders to execute data analysis projects and present…",Posted30+ days ago,"$30,000 - $40,000 a month","$30,000 - $40,000 a month",https://www.indeed.com/rc/clk?jk=b75a58495fc23b9d&fccid=8aa104e7f8db0cd3&vjs=3
"Senior Analyst, Data Analytics",TransUnion,Hong Kong,"Support statistical analysis of risk & business data.
3+ years of relevant experience in data science /analytics.
Proficiency in both English and Chinese.",Posted5 days ago,Full-time,,https://www.indeed.com/rc/clk?jk=9903211db21a5660&fccid=663ece44ae074b32&vjs=3
Assistant Data Analytics Manager,Hays,Hong Kong,"Design, develop and manage data warehouse, consolidate, and integrate data from diversified data.
5+ years of experience in data analytics, managing data…",Posted30+ days ago,,,https://www.indeed.com/rc/clk?jk=60de47f3ed5d8c73&fccid=31670bef3ae6497b&vjs=3
Senior Data Scientist (Recommendation System Direction),"TCL Corporate Research (Hong Kong) Co., Limited",New Territories,"Excellent coding ability, solid data structure, and algorithm skills;
Experiments on applying data mining, deep learning, machine learning algorithms into real…",Posted24 days ago,Full-time,,https://www.indeed.com/rc/clk?jk=5b758da286a267ba&fccid=c2ff9592b3ffc44f&vjs=3
