job_title,company,location,job_summary,post_date,more_info,salary,job_url
Head of Data,Savii (Uploan PH),Remote in Makati,Due to continued growth within Savii and the evolution of our data assets we intend to recruit a Head of Data with relevant leadership and communication skills…,PostedPosted 11 days ago,Full-time,,https://www.indeed.com/company/Savii-(Uploan-PH)/jobs/Head-Data-79bce0b978d53b38?fccid=12084f4fbdac600c&vjs=3
Data Scientist (Remote Possible),Glints,Remote in Manila,"Experience in data mining to creatively identify features from our dataset.
Relevant experience working with recommendation models or algorithms.",PostedPosted 30+ days ago,Full-time,,https://www.indeed.com/rc/clk?jk=950681c2d88d3987&fccid=d1fae73a5e8f26e2&vjs=3
Data Scientist - Team Lead,Crowdsource Innovative Solutions,Pasig,"Develop and monitor data quality metrics and ensure business data and reporting needs are met.
Employ sophisticated analytics programs, machine learning and…",EmployerActive 16 days ago,"PHP 40,000 - PHP 50,000 a month","PHP 40,000 - PHP 50,000 a month",https://www.indeed.com/company/Crowdsource-Innovative-Solutions/jobs/Data-Scientist-c0fc082ec4339af8?fccid=db03bb69edfa1556&vjs=3
Data Scientist,Arch Global Services,Quezon City,Manipulate data using R or SQL Server; develop advanced ad hoc queries to investigate data anomalies and to summarize data for pattern detection.,PostedPosted 30+ days ago,,,https://www.indeed.com/rc/clk?jk=d97f3b4186d42eba&fccid=9510a01d533e2443&vjs=3
Data Science,Emerson Philippines,Quezon City,"Education: University degree (Computer Science, Computer Engineering, Information Technology, Information Systems or similar).
Power BI (or similar tools).",Hiring ongoing,Full-time,,https://www.indeed.com/company/Emerson/jobs/Data-Science-9fec547da5038fc6?fccid=c3d73a6fd53e8543&vjs=3
Data Science Specialist,Talentium Inc,Mandaluyong,"Experience with common data science tools and packages.
Handling data of huge volume and varied complexity.
Engage in the end-to-end lifecycle of data science…",PostedPosted 30+ days ago,Full-time,,https://www.indeed.com/company/Talentium-Inc/jobs/Data-Science-Specialist-276f00c3ef0a855d?fccid=cc763b01279c0186&vjs=3
Senior Data Scientist (for pooling),Lexmark Research and Development Corporation,Cebu City,"Be involved in “data lake + data factory” deliverables that will ultimately benefit ML automation.
He/She will be engaged as well in the “data lake” pillar.",PostedPosted 30+ days ago,Full-time,,https://www.indeed.com/company/Lexmark-Research-and-Development-Corporation/jobs/Senior-Data-Scientist-ab3339cfae875237?fccid=6347e5793a266032&vjs=3
Head of Data & Analytics,Trialfacts,Remote in Manila,"Model — We use Funnel (https://funnel.io/) to do the heavy lifting of connecting to our data sources as well as grouping, cleaning and mapping our data.",PostedPosted 30+ days ago,Full-time,,https://www.indeed.com/rc/clk?jk=ad2dca4caf33adcf&fccid=1170e18aebf5cdbc&vjs=3
Data Analytics Manager,EASTWEST AGEAS LIFE INSURANCE CORPORATION,Taguig,"The jobholder analyses data through the application of scientific methods and data-discovery tools.
Strong experience and skills in machine learning, data…",PostedPosted 2 days ago,Full-time,,https://www.indeed.com/company/EASTWEST-AGEAS-LIFE-INSURANCE-CORPORATION/jobs/Data-Analytic-Manager-12267f363928ae85?fccid=ad63949345fc9fd2&vjs=3
Pricing Transformation Data Scientist (Python Developer),IWG Plc,Manila,"Strong analytical capabilities and data visualization in Python, comfortable with large data sets.
Knowledge of data engineering, preferably SQL pipelines +…",PostedPosted 11 days ago,Full-time,,https://www.indeed.com/company/IWG-Plc/jobs/Pricing-Transformation-Data-Scientist-f486f6e6b5bcddba?fccid=526dc61714868c28&vjs=3
Data Scientist,Monroe Consulting Group Philippines,Remote in Taytay,"Mining and analyzing data from company databases to improve marketing, product development, or overall business strategies.",PostedPosted 30+ days ago,"PHP 70,000 - PHP 90,000 a month","PHP 70,000 - PHP 90,000 a month",https://www.indeed.com/company/Monroe-Consulting-Group-Philippines/jobs/Data-Scientist-f7f3a1ff3502b191?fccid=7f55fd7ae2d0fa1f&vjs=3
AI Engineer,Talentium Inc,Ortigas,"With experience in predictive modeling and data analysis.
Looking forward to solving data-related problems and puzzles.
MySQL, Snowflake, GCP/AWS, and Tableau.",Employer30+ days ago,,,https://www.indeed.com/company/Talentium-Inc/jobs/Ai-Engineer-b864aa0cff365bd6?fccid=cc763b01279c0186&vjs=3
"Data Scientist/Data Analytics(R, Tableau, SQL) - Hybrid Work...",JK Network Services,Remote in Pasig,"2-3 years work experience in data science or data analytics.
Skilled in statistical programing, data analysis, statistical modeling and data extraction.",PostedPosted 30+ days ago,"PHP 35,000 - PHP 40,000 a month","PHP 35,000 - PHP 40,000 a month",https://www.indeed.com/company/JK-Network-Services/jobs/Data-Scientist-Data-Analytic-636051ebae000797?fccid=62bd09cb34df5ce3&vjs=3
Data Analytics (EH 2160),Accenture,Quezon City,"Cleansing data and automating the process if needed.
Intermediate level in data visualization and business intelligence tools such as Tableau, Power BI or…",Hiring ongoing,Full-time,,https://www.indeed.com/company/Accenture/jobs/Data-Analytic-5af26e663d79c1b0?fccid=a4e4e2eaf26690c9&vjs=3
Data Science Specialist,Talentium Inc.,Mandaluyong,"Experience with common data science tools and packages.
Handling data of huge volume and varied complexity.
Engage in the end to end lifecycle of data science…",PostedPosted 30+ days ago,Full-time,,https://www.indeed.com/company/Talentium-Inc/jobs/Data-Science-Specialist-b4d57b59ef5b592c?fccid=cc763b01279c0186&vjs=3
AI Developer (Machine Learning) | up to 80k Joining Bonus!*,Accenture,Mandaluyong,"Experience in using statistical computing languages (R, Python, etc.) to manipulate data and draw insights from those data sets.",Hiring ongoing,"PHP 28,000 - PHP 94,000 a month","PHP 28,000 - PHP 94,000 a month",https://www.indeed.com/company/Accenture/jobs/Ai-Developer-Joining-Bonus-77d81deede648be3?fccid=a4e4e2eaf26690c9&vjs=3
Data Science & Analytics Director,Arbeit Infotech Inc,Remote in Quezon City,"Extract and consume data to analyze and produce robust advanced analytics models / outcomes.
Highly competent technically with significant, hands-on expertise…",PostedPosted 26 days ago,Full-time,,https://www.indeed.com/company/Arbeit-Infotech-Inc/jobs/Data-Science-Analytic-Director-51d2a53e2e6f13d5?fccid=018d85ff17d0b8c8&vjs=3
Data Analytics Analyst | Python and R Programming (EH 1917),Accenture,Quezon City,"Collaborate with other data scientists, subject matter experts, sales, and delivery teams from Accenture locations around the globe to deliver strategic…",Hiring ongoing,Full-time,,https://www.indeed.com/company/Accenture/jobs/Data-Analytic-Analyst-Python-R-Programming-1b87d45d2b10d3fc?fccid=a4e4e2eaf26690c9&vjs=3
Adjunct Faculty - Data Science (Remote),eduCLaaS,Remote in Manila,"Data science trainer: 3 years (Required).
3+ years of experience in data science and machine learning.
O Azure Machine Learning knowledge especially with data…",EmployerActive 15 days ago,,,https://www.indeed.com/company/Lithan-Academy/jobs/Adjunct-Faculty-0345ba046a60e70c?fccid=6dff6b8f30346964&vjs=3
Data Analytics Officer,"Asia Select, Inc.",Remote in National Capital Region,"Assess availability and quality of data points to be used.
Generate insights from raw data sets to address business questions and support continuous business…",PostedPosted 30+ days ago,,,https://www.indeed.com/rc/clk?jk=176f35d3bc165fa2&fccid=69051506053b6ecc&vjs=3
Sr. Data Science Analyst,Full Potential Solutions,Remote in Pasig,"Ability to perform complex data analyses with large data volumes.
Further, they will spend time on data strategy, mapping our data sources, and keeping records.",EmployerActive 25 days ago,Full-time,,https://www.indeed.com/company/Full-Potential-Solutions/jobs/Senior-Data-Science-Analyst-28d9b65fa6ebeac7?fccid=c29f5a14440ca376&vjs=3
Computer Vision Engineer | up to 80k Joining Bonus!*,Accenture,Mandaluyong,"Analyze data and formulate modeling approaches.
Demonstrated analytical thinking through data-driven decisions.
Data analysis and feature engineering.",Hiring ongoing,"PHP 28,000 - PHP 94,000 a month","PHP 28,000 - PHP 94,000 a month",https://www.indeed.com/company/Accenture/jobs/Computer-Vision-Engineer-Joining-Bonus-64a0b47a4d4a5a8f?fccid=a4e4e2eaf26690c9&vjs=3
"Data Science & Analytics Director - Eastwood, QC - Hybrid",Nezda Technologies,Remote in Quezon City,"Extract and consume data to analyze and produce robust advanced analytics models / outcomes.
Highly competent technically with significant, hands-on expertise…",PostedPosted 26 days ago,Full-time,,https://www.indeed.com/company/Nezda-Technologies/jobs/Data-Science-Analytic-Director-a77465400fb9449f?fccid=cf34e5641183f768&vjs=3
Senior Data Scientist,Scrubbed,Remote,"Implement and test data modeling designs.
Experience handling large datasets in different formats, diving into data to discover hidden patterns, using data…",PostedPosted 30+ days ago,,,https://www.indeed.com/rc/clk?jk=4df9f778a95ee1bd&fccid=b86329bf01c3ff25&vjs=3
Threat Analytics Engineer,Equinix,Remote in Manila,"O Distill and plot data to create consumable dashboards.
Writing scripts to call APIs and perform webscraping to store that data in a database for further…",EmployerActive 15 days ago,"PHP 100,000 a month","PHP 100,000 a month",https://www.indeed.com/company/Equinix/jobs/Threat-Analytic-Engineer-afe3df2ac4267731?fccid=e15d9e27876d9dc3&vjs=3
DATA MODELLING AND​ ANALYTICS SPECIALIST,JG Summit Olefins Corporation,Pasig,"Knowledgeable in data warehousing​.
The job holder is responsible for the organization of the sales and market data structure of the Polymer Sales Division,…",Hiring ongoing,Full-time,,https://www.indeed.com/company/JG-Summit-Olefins-Corporation/jobs/Data-Modelling-Analytic-Specialist-3131eb45efa5aeed?fccid=76a918b37dce40dd&vjs=3
Cloud Database Administrator,Tri-Unity Talent Sourcing & HR Services,Makati,"Implement compliance controls for sensitive data.
Evaluate offline or online data migration strategies.
Implement security for data in transit and at rest.",Posted16 days ago,"PHP 45,000 - PHP 50,000 a month","PHP 45,000 - PHP 50,000 a month",https://www.indeed.com/company/Iyuno-SDI/jobs/Cloud-Database-Administrator-bff47aeeeab516be?fccid=c6ac30c6192bcab4&vjs=3
Sr. Manager - Customer Experience Analytics,Concentrix,Baguio,"Conducts planning, data collection, data cleansing and data linkage in preparation for analysis.
Analyzes qualitative and quantitative data and identifies…",EmployerActive 22 days ago,"PHP 70,000 - PHP 100,000 a month","PHP 70,000 - PHP 100,000 a month",https://www.indeed.com/company/Concentrix/jobs/Senior-Manager-908e039a8d5beb61?fccid=773041d0d31c442a&vjs=3
Data & Analytics Architect,Manpower Core Group Inc.,Makati,"10+ years of professional experience in the Data & Analytics area.
2+ years of experience in the Architect or Senior Consultant role.",Hiring ongoing,Full-time,,https://www.indeed.com/company/Manpower-Group-Extra/jobs/Data-Analytic-Architect-b0fd761ab7e817b3?fccid=baf56e0d326cb53b&vjs=3
Data Science Team Lead - Shared Services (Night Shift),PSB Technology Services Inc.,Remote in Pasig,"Develop and monitor data quality metrics and ensure business data and reporting needs are met.
Employ sophisticated analytics programs, machine learning and…",Hiring ongoing,"PHP 50,000 a month","PHP 50,000 a month",https://www.indeed.com/company/Pioneer-Square-Brands/jobs/Data-Science-Team-Lead-707d5020de969ae5?fccid=9341fff88d937993&vjs=3
Model Ops-ML Engineer | up to 80k Joining Bonus!*,Accenture,Mandaluyong,"With Big data and Hadoop experience.
With Big data and Hadoop experience.
Must have at least 2 years of experience in providing data warehousing solutions.",Hiring ongoing,"PHP 28,000 - PHP 94,000 a month","PHP 28,000 - PHP 94,000 a month",https://www.indeed.com/company/Accenture/jobs/Model-Ops-Ml-Engineer-Joining-Bonus-b93c6a19baeb8065?fccid=a4e4e2eaf26690c9&vjs=3
Machine Learning Engineer,BreederDAO,Remote in Makati,"Understanding of data structures, data modeling and software architecture.
Study and transform data science prototypes.
Play to earn game domain knowledge.",Posted24 days ago,Full-time,,https://www.indeed.com/rc/clk?jk=44c49d287d399752&fccid=990df6b2e477863c&vjs=3
Natural Language Processing (NLP) Engineer | up to 80k Joini...,Accenture,Mandaluyong,"Experience with data operations and data management.
Reviewing, evaluating, and analyzing data quality before delivery.
Pag-IBIG Member’s Data Record (MDR).",Hiring ongoing,"PHP 28,000 - PHP 64,000 a month","PHP 28,000 - PHP 64,000 a month",https://www.indeed.com/company/Accenture/jobs/Natural-Language-Processing-Engineer-Joining-Bonus-fc16459cd42af1b8?fccid=a4e4e2eaf26690c9&vjs=3
JUNIOR TO SENIOR DATA SCIENTISTS (good offer/work-from-home),ZAPGROUP INC,Remote in Pasig,"The ideal candidate possesses experience processing large data sets to help identify product opportunities, optimize merchant promotions to drive sales and…",EmployerActive 15 days ago,Full-time,,https://www.indeed.com/company/ZAPGROUP-INC/jobs/Junior-Senior-Data-Scientist-37ddde67ba776eb8?fccid=1d416ffd90f9998b&vjs=3
Machine Learning Engineer,Docquity Philippines Corporation,Hybrid remote in Taguig,"Collaborates with the data analysts and data scientists to develop new ideas and machine.
D. Process the data and engineer features.",Posted30+ days ago,Full-time,,https://www.indeed.com/rc/clk?jk=6d8055dc69e12448&fccid=65cc02174a2f1d5c&vjs=3
Data Scientist,Recruitment Specialists Philippines,Albay,"Processing, cleansing and verifying data integrity used for the analysis processes.
Extraction y selection of different features, building and optimizing…",Posted30+ days ago,Full-time,,https://www.indeed.com/rc/clk?jk=67f1c29a7b945096&fccid=c7866c9119f6f575&vjs=3
Data Scientist,ConnectOS,Remote in Mandaluyong,"Deep experience of data manipulation/wrangling techniques for different data types (structured, semi-structured, and unstructured).",Posted30+ days ago,Full-time,,https://www.indeed.com/rc/clk?jk=bfdbf5b3b90d4acf&fccid=cae8a0c9facabf2a&vjs=3
Sr Manager for Customer Experience Analytics (for Baguio Sit...,Concentrix,Baguio,"Conducts planning, data collection, data cleansing and data linkage in preparation for analysis.
Analyzes qualitative and quantitative data and identifies…",Posted30+ days ago,Full-time,,https://www.indeed.com/company/Concentrix/jobs/Senior-Manager-Customer-Experience-Analytic-1406a3dbc0cef88b?fccid=773041d0d31c442a&vjs=3
