job_title,company,location,job_summary,post_date,more_info,salary,job_url
Junior Data Scientist,Isentia - Talent International (RPO),Temporarily Remote in Pasig,"1 to 2 years of work experience in data mining and data science.
Basic proficiency in data science/data mining along with text mining, Natural Language…",PostedPosted 5 days ago,Full-time,,https://www.indeed.com/company/Isentia/jobs/Junior-Data-Scientist-0a0377137dfc2912?fccid=5138d35be7021815&vjs=3
"Data Scientist (Analytics), Philippines",Grab,Manila,"Use data to identify trends, spot anomalies and deepdive into their root causes.
Hone your data storytelling skills through visualisation techniques by building…",PostedPosted 30+ days ago,Full-time,,https://www.indeed.com/rc/clk?jk=8dee31abc0f3a13f&fccid=b79fa3ee18655a5a&vjs=3
Data Scientist,DTN,Manila,"Reporting to the principal data scientist in Manila, this person will use our proprietary datasets to solve interesting and challenging problems for our…",PostedPosted 16 days ago,Full-time,,https://www.indeed.com/rc/clk?jk=0b33d17d2f485028&fccid=e800d97a89d68322&vjs=3
Data Scientist,ING,Taguig,"Data Preparation and Exploration - Prepares data from complex applications and messy data sources, actively builds solutions for others to use.",PostedPosted 30+ days ago,,,https://www.indeed.com/rc/clk?jk=7415358025786de6&fccid=5b16841c3468a10d&vjs=3
"Data Scientist (Analytics), Philippines",Kudo,Philippines,"Use data to identify trends, spot anomalies and deepdive into their root causes.
Hone your data storytelling skills through visualisation techniques by building…",PostedPosted 30+ days ago,,,https://www.indeed.com/rc/clk?jk=1ee95e36824ad083&fccid=dcd77e8a328a074f&vjs=3
Data Scientist,Meralco,Philippines,"College graduate with a degree in Computer Science, Mathematics, Physics, Statistics or similar course.
Knowledgeable with statistical programming language (i.e…",PostedPosted 30+ days ago,,,https://www.indeed.com/rc/clk?jk=a975f7c1b31775ea&fccid=0daef1c3655087ca&vjs=3
Data Scientist,Elgada BPO Solutions Inc.,Remote in Makati,"Find patterns in data that will allow us to build more effective use cases in our applications, cut down on inefficiencies caused by not having data properly…",PostedPosted 9 days ago,Full-time,,https://www.indeed.com/rc/clk?jk=04e841ee5931a45f&fccid=beaa40c7e2954fcf&vjs=3
Data Scientist - AI Developer,Esco Lifesciences Group,Pasay,Esco is currently looking for a data scientist to discover information in the company enterprise system including machine and manufacturing data as well as…,PostedPosted 30+ days ago,,,https://www.indeed.com/rc/clk?jk=6180297d9d181291&fccid=4e5360590a8972dd&vjs=3
Data Scientist,Investagrams,Makati,"Basic knowledge of data visualization tools such as Tableau, QlikView, open source data visualization libraries - ggplot and d3.js.",PostedPosted 30+ days ago,Full-time,,https://www.indeed.com/rc/clk?jk=301c6c4f1d0e9315&fccid=0a1822314a93d70b&vjs=3
Data Scientist,ATR Asset Management (ATRAM),Makati,Pre-process and use data wrangling techniques to clean and transform the data; provide inputs on enhancing data collection and quality to support data…,PostedPosted 11 days ago,Full-time,,https://www.indeed.com/rc/clk?jk=c2ada1959c3831e0&fccid=709b5b935cba8661&vjs=3
"Associate Data Scientist, Advanced Analytics",Manulife,Quezon City,"Advanced technical knowledge of data and data concepts; Ability to educate others.
The Manulife Audit Services Data Analytics group supports the global audit…",PostedPosted 3 days ago,Full-time,,https://www.indeed.com/rc/clk?jk=c52f754056be9d5e&fccid=1747adf6142beb48&vjs=3
Data Scientist (Manila),UMS Group,Remote in Manila,"Experience building Machine Learning models using training data and test data (i.e. Get data; Clean, prepare & manipulate data; Train model; Test data; Improve)…",PostedPosted 30+ days ago,,,https://www.indeed.com/rc/clk?jk=8f2d7620b347eacd&fccid=6ee7699f5525c4ab&vjs=3
Data Scientist,Shell,Makati,"Strong experience in data science/Analytics, particularly Machine Learning.
Generating business insights from data analytics at the request from the business,…",PostedPosted 30+ days ago,,,https://www.indeed.com/rc/clk?jk=8c962ddbf2db0b6b&fccid=167aa4ca2fe7d8e6&vjs=3
Data Scientist,SariSuki,Quezon City,"Proficiency in data engineering or data architectures.
Perform data analysis required to troubleshoot data issues.
Strong math and statistics skills.",PostedPosted 30+ days ago,Full-time,,https://www.indeed.com/rc/clk?jk=ec1f63ce516b912f&fccid=be3517b93ad95323&vjs=3
Data Scientist,SN Aboitiz Power Group,Taguig,"Work closely with other teams in OCIO such as enterprise architecture, data management, and systems teams in creating data applications through the utilization…",PostedPosted 30+ days ago,Full-time,,https://www.indeed.com/rc/clk?jk=0e79d676c872083e&fccid=bd82e056815dae67&vjs=3
Senior Data Scientist,LeapFroggr Inc.,Remote in Manila,"They must have strong experience using a variety of data mining/data analysis methods, using a variety of data tools, building and implementing models, using…",PostedPosted 30+ days ago,Full-time,,https://www.indeed.com/rc/clk?jk=7d9417352167d944&fccid=88923110bfa7cfa6&vjs=3
Analytics Leads / Senior Data Scientists,Thakral One,Philippines,Provides mentorship and knowledge transfer to other Advanced Analytics Consultants/Data scientists to help motivate and advance their skills.,PostedPosted 30+ days ago,,,https://www.indeed.com/rc/clk?jk=4256f65e2ffda438&fccid=4e85708068ce4508&vjs=3
"Data Scientist (Analytics), Philippines",Grabtaxi holdings pte ltd,Manila,"Use data to identify trends, spot anomalies and deepdive into their root causes.
Hone your data storytelling skills through visualisation techniques by building…",PostedPosted 30+ days ago,,,https://www.indeed.com/rc/clk?jk=9d246617746da2a1&fccid=4c75c88156c5f631&vjs=3
Associate Data Scientist,Manulife,Quezon City,"Communicates results of cases of limited complexity to more senior data scientists and business partners.
Developing ability to generate relevant, actionable…",PostedPosted 18 days ago,Full-time,,https://www.indeed.com/rc/clk?jk=12a343e52f0540b7&fccid=1747adf6142beb48&vjs=3
Data Scientist,Vestas,Pasay,"Have experience with data pipelines and ETL processes, data warehouses/lake, data modeling, and schema design, ideally with larger volumes of data.",PostedPosted 30+ days ago,,,https://www.indeed.com/rc/clk?jk=4e63298a6ada84f3&fccid=4e8a74cd622db073&vjs=3
Associate Data Scientist,Cognizant,Manila,"Good understanding of RDBMS, BigData concepts and unstructured data, and exposure to multiple data platforms to fetch and analyse data ( strong SQL querying…",PostedPosted 16 days ago,Full-time,,https://www.indeed.com/rc/clk?jk=54fd73501af70b88&fccid=2df6a1e69a70a1e7&vjs=3
Client Engineering - Data Scientist: Generalist,IBM,Taguig,"At least 2 years of experience with identifying data sources, transforming data, etc.
Be familiar with Data Engineering techniques to gathers, prepare, cleanse,…",PostedPosted 9 days ago,Full-time,,https://www.indeed.com/rc/clk?jk=38067cd842cba367&fccid=de71a49b535e21cb&vjs=3
Data Scientist Specialist,Accenture,Manila,"Analyze ticketing data to provide actionable insights.
Visualize digital analytics to show valuable data driven insights using BI tools.",PostedPosted 30+ days ago,Full-time,,https://www.indeed.com/rc/clk?jk=3a86b5a5ed3f197b&fccid=a4e4e2eaf26690c9&vjs=3
Data Scientist Offshore,DXC Technology,Taguig,"Develop custom data models and algorithms to apply to data sets.
Assess the effectiveness and accuracy of new data sources and data gathering techniques.",PostedPosted 30+ days ago,Full-time,,https://www.indeed.com/rc/clk?jk=edb7b1e859277b92&fccid=feaabf8e6a699d3c&vjs=3
Data Scientist,Cognizant,Quezon City,"Good understanding of RDBMS, BigData concepts and unstructured data, and exposure to multiple data platforms to fetch and analyse data ( strong SQL querying…",PostedPosted 16 days ago,,,https://www.indeed.com/rc/clk?jk=4b7a3b5d1d997135&fccid=2df6a1e69a70a1e7&vjs=3
Senior Statistical Data Scientist (Flex Work),GfK,Hybrid remote in Makati,Work with the other Data Scientists to improve the POS design through statistical data modelling of online and traditional retailers.,PostedPosted 30+ days ago,Full-time,,https://www.indeed.com/rc/clk?jk=921fdb8772475099&fccid=941c4fb004be80b8&vjs=3
Data Scientist,Security Bank Corporation,Philippines,"Experience in data mining and wrangling.
At least 5 years of data analysis experience.
Able to perform data modeling, including feature selection and…",PostedPosted 30+ days ago,,,https://www.indeed.com/rc/clk?jk=7f8490a5d657c39c&fccid=03112633f308e8a5&vjs=3
Data Scientist,SM PRIME,Pasay,"Lead the Data Preparation (identify, collect, cleanse, and consolidate) process and perform rigorous integrity and sense checks of data to assess its quality,…",PostedPosted 30+ days ago,Full-time,,https://www.indeed.com/rc/clk?jk=805736d45448269a&fccid=917f9e19881cf277&vjs=3
Senior Data Scientist,All Value,Philippines,". Identify additive data requirements and help source new datasets.
Your primary focus will be in applying data mining and wrangling techniques, doing…",PostedPosted 8 days ago,,,https://www.indeed.com/rc/clk?jk=bc62fa41d2166c6a&fccid=1f93f2672f986baf&vjs=3
Data Scientist,EMAPTA,Philippines,"Focusing on driving machine learning in a variety of areas focused around empowering our customers to create high converting content, optimize their ad…",PostedPosted 30+ days ago,Full-time,,https://www.indeed.com/rc/clk?jk=c7e62cc05f9420e4&fccid=2c95d4f01f0c0a46&vjs=3
Junior Data Scientist,All Value,Philippines,". Identify additive data requirements and help source new datasets.
Your primary focus will be in applying data mining and wrangling techniques, doing…",PostedPosted 8 days ago,,,https://www.indeed.com/rc/clk?jk=bd460a81ab1f342a&fccid=1f93f2672f986baf&vjs=3
Data Science,Accenture,Manila,"O Knowledge and experience in statistical and data mining techniques.
Must have at least 1 year of experience manipulating data sets and building statistical…",PostedPosted 30+ days ago,Full-time,,https://www.indeed.com/rc/clk?jk=ca45ba4be13007ff&fccid=a4e4e2eaf26690c9&vjs=3
Data Scientist (Marketing),"8x8, Inc.",Manila,"Experience in complex data cleansing, data validation and master data management.
Experience managing and working with large databases, data management,…",PostedPosted 1 day ago,Full-time,,https://www.indeed.com/rc/clk?jk=a947285a842f5338&fccid=7491aa7b74269d37&vjs=3
GBS Data Scientist Associate,JTI - Japan Tobacco International,Taguig,"She or he is required to work with other business stakeholders, data analysts, data scientists, and data strategists to define and develop data opportunities,…",PostedPosted 25 days ago,,,https://www.indeed.com/rc/clk?jk=98b9fbc587e096ec&fccid=09dc3054e100db9a&vjs=3
Lead Data Scientist,Bold Business,Remote in Zamboanga City+11 locations,"Support the technology needs of various departments by creating a data-literate ecosystem.
The technical ability to inform our CTOs views on deployment of data…",PostedPosted 30+ days ago,Full-time,,https://www.indeed.com/rc/clk?jk=872fd8ceb8fb9124&fccid=f8cff51ef12108db&vjs=3
Data Analytics Analyst 1,IQVIA,Pasig,"Researches and responds to client inquiries regarding data trends, data applications, IQVIA systems, or methodologies.",PostedPosted 17 days ago,Full-time,,https://www.indeed.com/rc/clk?jk=8abf2c95de024b84&fccid=6b7a1dfe07e7f037&vjs=3
Data Scientist,Codeninja,Manila,"You should be comfortable querying and filtering large amounts of data, cleaning up data programmatically, and slicing quick samples of the data.",PostedPosted 30+ days ago,,,https://www.indeed.com/rc/clk?jk=7b31ff53343e537c&fccid=ba49624ec18c6c85&vjs=3
Data Scientist- Sales & Servicing,Inchcape Digital,Philippines,"You have 4+ years as a practicing data scientist, analyst or data/analytics engineer.
Working across our global community of data scientists and engineers — and…",PostedPosted 26 days ago,,,https://www.indeed.com/rc/clk?jk=7498659b15a90d79&fccid=216130330358b7be&vjs=3
Data Scientist II,Alorica Teleservices Inc,Philippines,"While transactional data may be structured and within a data warehouse, nearly every project will require that you merge external structured or semi-structured…",PostedPosted 30+ days ago,,,https://www.indeed.com/rc/clk?jk=f16ccac902fecb0f&fccid=dd616958bd9ddc12&vjs=3
Data Scientist,Cloudstaff,Philippines,"You should be comfortable querying and filtering large amounts of data, cleaning up data programmatically, and slicing quick samples of the data.",PostedPosted 30+ days ago,,,https://www.indeed.com/rc/clk?jk=e3f39b089be98a82&fccid=c33ed0b8ec64852d&vjs=3
DigitalBCG | GAMMA Data Scientist/Senior Data Scientist,Boston Consulting Group,Manila,"Explain sophisticated data science concepts in an understandable manner.
Significant experience applying advanced analytics to a variety of business situations…",PostedPosted 30+ days ago,,,https://www.indeed.com/rc/clk?jk=3a92684b2e83e3dd&fccid=b95f9eb47968fa13&vjs=3
Data Scientist,Asian Institute of Management,Makati,"Strong coding, problem-solving and data engineering skills.
Collaborate with scientists and other team members of ACCeSs to achieve project goals.",PostedPosted 30+ days ago,,,https://www.indeed.com/rc/clk?jk=26335d089dd97c9b&fccid=af7225d23f031a82&vjs=3
Data Scientist,Security Bank Careers,Makati,"Experience in data mining and wrangling.
At least 5 years of data analysis experience.
Able to perform data modeling, including feature selection and…",PostedPosted 30+ days ago,,,https://www.indeed.com/rc/clk?jk=dfeee03a64a851c7&fccid=524d9a18e20e8ac2&vjs=3
Shopee Xpress - Sorting Centre - Reporting & Analytics,Shopee,Manila,"Drive the standardization of data metrics by leveraging data- and business process knowledge.
Develop and implement new reports and data to benefit various…",PostedPosted 11 days ago,,,https://www.indeed.com/rc/clk?jk=72ca2b7250152bca&fccid=0b476c4a7add47fe&vjs=3
Data Scientist,Satellite Office Solutions Pty Ltd,Philippines,"Transactionaltrading data & customer dimension data.
Transactionaltrading data & customer dimension data.
. Actively contribute to discussions about data flow…",PostedPosted 30+ days ago,,,https://www.indeed.com/rc/clk?jk=92ef39cd33f187d9&fccid=1c8629870f051d5b&vjs=3
Data Scientist (Work from Home),The Penbrothers International Inc,Remote in Manila,"Interpret data and analyze results using statistical techniques.
Drive efficiencies in business with automation of data and information, and identify areas of…",PostedPosted 30+ days ago,,,https://www.indeed.com/rc/clk?jk=31a71ee62535ac8f&fccid=497163ef03abc797&vjs=3
Brand Partner Specilaist (Data and AI),IBM,Taguig,"IBM provides you with the most comprehensive and consistent approach to development, security and operations across hybrid environments—with complete software…",PostedPosted 12 days ago,Full-time,,https://www.indeed.com/rc/clk?jk=f2667eb764cac6e9&fccid=de71a49b535e21cb&vjs=3
Junior Statistical Data Analyst,Inchcape Digital,Philippines,"Expertise in data retrieval, data modeling, data warehouse design, and predictive modeling.
Developing and maintaining databases, data systems – reorganizing…",PostedPosted 26 days ago,,,https://www.indeed.com/rc/clk?jk=c96036067701609a&fccid=216130330358b7be&vjs=3
DATA ANALYTICS SPECIALIST,"Unilab, Inc.",Manila,"Prepares data (including data cleanup/scrubbing) for all financial and non financial information that will be needed for data analysis by sourcing, gathering,…",PostedPosted 30+ days ago,,,https://www.indeed.com/rc/clk?jk=ee0a7da6b453deb0&fccid=d6ae62645042797f&vjs=3
BI Data Scientist,QUANTRICS,San Mateo,"Communicating and coordinating with teams to implement data-driven strategies while measuring progress.
Mining and analyzing data from company databases to…",PostedPosted 30+ days ago,Full-time,,https://www.indeed.com/rc/clk?jk=3822f69fe07d4a8c&fccid=173e5fd1bb02c9ab&vjs=3
Pricing Transformation Data Scientist,IWG,Manila,"Strong analytical capabilities and data visualisation in Python, comfortable with large data sets.
Knowledge of data engineering, preferably SQL pipelines +…",PostedPosted 30+ days ago,Full-time,,https://www.indeed.com/rc/clk?jk=68da1094e0f6259e&fccid=526dc61714868c28&vjs=3
Data Scientist,Stratpoint Technologies,Mandaluyong,The ideal candidate will have is adept in time series forecasting and analysis and has worked with varieties of time series data tied in with external…,PostedPosted 30+ days ago,Full-time,,https://www.indeed.com/rc/clk?jk=d1b7d2c52893ab65&fccid=373e4a8753cc6ca2&vjs=3
Data Science Engineer III,FactSet Research Systems,Manila,"Develop processes for data mining, data concordance and data production.
Experience building and optimizing ‘big data’ data pipelines, architectures and data…",PostedPosted 30+ days ago,Full-time,,https://www.indeed.com/rc/clk?jk=2a820b1662d948b9&fccid=7ca19d158e5b580d&vjs=3
Data Analytics - Scientist,Cloud Employee,Philippines,"Providing technical expertise in data storage structures, data mining, and data cleansing.
Commissioning and decommissioning of data sets.",PostedPosted 30+ days ago,,,https://www.indeed.com/rc/clk?jk=9f38ce50fb360bd2&fccid=cfc3cca3395f157c&vjs=3
"Specialist, Research Analytics",Concentrix,Davao City,"Manipulate large data to create datasets that fulfill project analytic requirements.
Ability to integrate data from various sources into a cohesive analysis.",PostedPosted 26 days ago,Full-time,,https://www.indeed.com/rc/clk?jk=a44b2a32c05e4c2f&fccid=773041d0d31c442a&vjs=3
Lead of Data Science Development & Experimentation,Inchcape Digital,Philippines,"You have 5+ years as a practicing data scientist, analyst, or data/analytics engineer.
You have (ideally) 4+ years’ experience with data modelling in a variety…",PostedPosted 26 days ago,,,https://www.indeed.com/rc/clk?jk=d4490e3907a25417&fccid=216130330358b7be&vjs=3
Business Intelligence-Data Scientist,"Qualfon Philippines, Inc.",Cebu City,". Ability to effectively utilize data discovery tools including C.
. 7 years of experience with research, data analysis and analytical work including experience…",PostedPosted 9 days ago,,,https://www.indeed.com/rc/clk?jk=20ee5d6f52aaddc8&fccid=48530ebbf9b5d97c&vjs=3
Data Scientist,Schneider Electric,Cavite+1 location,"Strong experience in batch data processing and data pipelines.
Strong experience in real-time data processing and data ingestion.",PostedPosted 30+ days ago,Full-time,,https://www.indeed.com/rc/clk?jk=7b41b5ae70b9b5ca&fccid=8dc4399ddb463d4a&vjs=3
Data Scientist,John Clements Consultants Inc,Manila,Analyze and model on big datasets - translating big data into actionable recommendations through implementation of data science and machine learning techniques …,PostedPosted 30+ days ago,,,https://www.indeed.com/rc/clk?jk=2886abcacf7456a1&fccid=85ec3875001f1130&vjs=3
Data Science Engineer,Amadeus,Taguig,"1+ years experience working with data technologies and data practices (SQL, DBMS, BI and Analytics, etc.).
Develop, maintain and support efficient, reliable and…",PostedPosted 22 days ago,Full-time,,https://www.indeed.com/rc/clk?jk=fb92698370271e0f&fccid=1174e11d97fd620e&vjs=3
Data Analyst | Makati,MedGrocer,Makati,"The Data Analyst supports various teams and initiatives with insights gained from data.
Experience in using programming languages (e.g. SQL, R, Python) for data…",Posted30+ days ago,Full-time,,https://www.indeed.com/rc/clk?jk=f831533ff9c52ac6&fccid=3fa184a04ae552b3&vjs=3
Marketing Data Scientist,"8x8, Inc.",Manila,"Experience in complex data cleansing, data validation and master data management.
Experience managing and working with large databases, data management,…",Posted30+ days ago,Full-time,,https://www.indeed.com/rc/clk?jk=38add1b829840320&fccid=7491aa7b74269d37&vjs=3
Machine Learning,Accenture,Manila,"Responsible for designing, building, and implementing AI projects such as virtual agents, text analytics, advanced analytics, mixed reality / augmented reality,…",Posted30+ days ago,Full-time,,https://www.indeed.com/rc/clk?jk=dd81d45fad0ff0d8&fccid=a4e4e2eaf26690c9&vjs=3
Quality Recruitment Specialist (Data Analytics),AIA,Taguig,"With 1 to 2 years working experience in technical data analysis, data science, data warehousing.
Comfort in a complex data environment and understanding of data…",Posted30+ days ago,Full-time,,https://www.indeed.com/rc/clk?jk=ee8fb068e1c43233&fccid=004041685e219574&vjs=3
Data Scientist,JG Summit,Philippines,You have the data intuition to identify opportunities for data acquisition and integration (I.e. you ask questions like: what if we connect this data to this…,Posted30+ days ago,,,https://www.indeed.com/rc/clk?jk=b45c88729e002035&fccid=233318a798c61ca8&vjs=3
Senior Business Intelligence Analyst (Data Scientist),Concentrix,Remote in Philippines,"This role mines data from a variety of data sources to strategically support, design, and predict outcomes with impactful recommendations to internal and/or…",Posted30+ days ago,Full-time,,https://www.indeed.com/rc/clk?jk=53f931044846aac1&fccid=773041d0d31c442a&vjs=3
Head of Data Science,AIA,Taguig,"Improving and assessing algorithms build by other data analytics and data scientist resources.
Build the data and analytics teams by assessing and learning data…",Posted30+ days ago,Full-time,,https://www.indeed.com/rc/clk?jk=0688c29c17d0a2c6&fccid=004041685e219574&vjs=3
"Lead, Interaction Analytics | Offshore | Aura",Teleperformance Philippines,Taguig,"The ideal candidate will possess strong analytical skills, root-cause analysis and attention to detail.
Construct searches and reports designed for automated…",Posted30+ days ago,Full-time,,https://www.indeed.com/rc/clk?jk=9993cb19233e0dbb&fccid=02e72612c7c0d1ce&vjs=3
Senior Data Scientist,Kumu,Manila,"Work closely with other data scientists, data engineers, machine learning engineers and other product teams.
Rapid experimentation by building prototypes using…",Posted30+ days ago,,,https://www.indeed.com/rc/clk?jk=9c1acace8b12e952&fccid=7f63a1c03d6cb38c&vjs=3
Data Analyst/Data Scientist,Hawodtechsolutions,Taguig,. Consult with stakeholders regarding the accuracy of data and the efficiency of the data acquisition/extraction process by having a sound knowledge of data…,Posted30+ days ago,,,https://www.indeed.com/rc/clk?jk=1eafc3b176a0b1bc&fccid=d5eea576183cfd08&vjs=3
Data Scientist,i21 recruitment,Makati," Implement data analytics models with integration of external data sources.
 Manage and explore client data to identify new business opportunities.",Posted30+ days ago,Full-time,,https://www.indeed.com/rc/clk?jk=f2a55c64ba493fb8&fccid=3a3dd833c554d890&vjs=3
Hiring Data Science Engineer,Sprout Solutions PH,Manila,"Experience with data modeling (data warehouse, data lake) and designing data storage schemes.
The Data Engineer will support our software engineers, architects…",Posted30+ days ago,Full-time,,https://www.indeed.com/rc/clk?jk=f20e93d0b20613e7&fccid=af7b42696bf7bd42&vjs=3
Data Science Consultant,AIA,Taguig+2 locations,"Improving and assessing algorithms build by other data analytics and data scientist resources.
Build the data and analytics teams by assessing and learning data…",Posted30+ days ago,Full-time,,https://www.indeed.com/rc/clk?jk=743da57415a38b03&fccid=004041685e219574&vjs=3
Analytics Advisory Specialist,Accenture,Manila,"Intermediate+ level of relational databases, SQL, or any data warehouse tools is an advantage.
As the Data Analytics Team Lead, you will be responsible for…",Posted30+ days ago,Full-time,,https://www.indeed.com/rc/clk?jk=ec8898d8decf48d2&fccid=a4e4e2eaf26690c9&vjs=3
Digital Analyst ‏ (Reporting and Advanced Analytics),Henkel,Makati,With a minimum of three (3) years relevant work experience in digital data analysis and reporting; Background in translating digital data into actionable…,Posted30+ days ago,Full-time,,https://www.indeed.com/rc/clk?jk=a5bcbfb8e959224c&fccid=79b1953a75a5cc1a&vjs=3
Senior Analytics Microservices Architect,Inchcape Digital,Philippines,"This will help us to build persuasive data science products (algorithms/use-cases).
You will work with a team of analysts & scientists and deliver projects…",PostedPosted 26 days ago,,,https://www.indeed.com/rc/clk?jk=903dda5f5a114b70&fccid=216130330358b7be&vjs=3
ESG Screening Content Technical Associate (Python/SQL),MSCI Inc,Manila,"Develop business understanding of data and data metrics to quantify coverage, quality and stability for existing or new data.
MSCI and Climate Action Group.",PostedPosted 3 days ago,Full-time,,https://www.indeed.com/rc/clk?jk=26817a01f4fd6250&fccid=c1f583e22ebf0f6e&vjs=3
"Senior Manager, Data Science",AIA,Taguig,"Responsible for creating data modelling tools to identify opportunities through insight from data.
Responsible in leading data science teams to create insights…",PostedPosted 30+ days ago,Full-time,,https://www.indeed.com/rc/clk?jk=5ff4b7c8c6d2cf9c&fccid=004041685e219574&vjs=3
Lead Computer Vision Engineer / Artificial Intelligence,Optimum Source Inc.,Pasig,"Computer Vision, Artificial Intelligence, Machine Learning (Deep Learning/Data Mining), Data Science.
MS or Ph.D in Computer Science, Machine Learning, or…",PostedPosted 30+ days ago,,,https://www.indeed.com/rc/clk?jk=81df54f4863a036c&fccid=c913944719a86c35&vjs=3
Data Scientist,ING Business Shared Services B.V.,Taguig,"Data Preparation and Exploration - Prepares data from complex applications and messy data sources, actively builds solutions for others to use.",PostedPosted 30+ days ago,,,https://www.indeed.com/rc/clk?jk=f5f7d6b51f4c1932&fccid=f619181018ab3c50&vjs=3
