job_title,company,location,job_summary,post_date,more_info,salary,job_url
Data Scientist,Willis Towers Watson,"Lima, Lima","This includes data wrangling, data cleaning, and exploratory analysis.
As a data scientist, you’ll work collaboratively with our business, operations, marketing…",Postedhace 2 días,,,https://www.indeed.com/rc/clk?jk=ccb5ec2ea127606c&fccid=fcd059ccedda91fb&vjs=3
PRACTICANTE DE DATA SCIENTIST,alicorp,"Lima, Lima",Apoyo identificando la problemática de negocio y elaborando análisis estadístico que ayuden a la toma de decisiones.,PostedHoy,Prácticas,,https://www.indeed.com/rc/clk?jk=ff3933768feca5a6&fccid=73d42433d20aee65&vjs=3
Data Scientist Jr.,Interbank,"Lima, Lima","Apoyar en el desarrollo modelos prescriptivos y predictivos para la gestión de riesgos de todo el ciclo de vida del cliente (Admisión, gestión, cobranza y…",Postedhace 2 días,Tiempo completo,,https://www.indeed.com/rc/clk?jk=2c2f98a472c81464&fccid=8359307539608691&vjs=3
Data Scientist Translator,Interbank,"Lima, Lima","Identificar y entender los problemas a resolver, en conjunto con los stakeholders.
Especialización en Data Scientist y/o Estadística.",Postedhace 30+ días,Tiempo completo,,https://www.indeed.com/rc/clk?jk=c0b3e4559a50a7e5&fccid=8359307539608691&vjs=3
Data Scientist,Pacifico Seguros,"San Isidro, Lima","Construir modelos analíticos eficientes y precisos que identifiquen y puedan ayudar a simular las decisiones empresariales.
Tipo de trabajo: Full-time.",Postedhace 30+ días,Tiempo completo,,https://www.indeed.com/rc/clk?jk=5641cbcf44de8df7&fccid=510bd4f5f7b09b7d&vjs=3
Senior Data Scientist,Launch Potato,"Lima, Lima","Work with large amounts of data to identify and act on opportunities in monetization strategies.
Apply advanced statistical techniques to establish causal…",Postedhace 30+ días,,,https://www.indeed.com/rc/clk?jk=2d8e9522f5f54a7b&fccid=dac5dfa9f05470c2&vjs=3
Data Scientist -,Intercorp Retail,"Chorrillos, Lima","Deseable manejo de tecnologías de big data y cloud computing (spark, hadoop, aws, google cloud, etc).
Carreras universitarias de Estadisticas, Ingenieria…",Postedhace 30+ días,,,https://www.indeed.com/rc/clk?jk=ed54a936a6ba503b&fccid=fe805f6db7e01bef&vjs=3
DATA SCIENTIST ASSOCIATE I,BBVA,"Lima, Lima",Area: Deadline for applying: 8/18/2022 Company: 081 What are we looking for? About you Insert the profile description here Your experience Insert the…,Postedhace 2 días,,,https://www.indeed.com/rc/clk?jk=3d1f8b8d6a4732c1&fccid=c938a854fbd13908&vjs=3
DATA SCIENTIST,BCP,"Lima, Lima","Queremos que tu talento se sume al del BCP, para seguir siendo el banco que todo el tiempo está innovando, es pionero y digital.
PL/SQL o SQL - Intermedio.",Postedhace 30+ días,Tiempo completo,,https://www.indeed.com/rc/clk?jk=7b202c974fca9fe8&fccid=ef32c9f4dceb57d8&vjs=3
Lead Data Scientist,Pacifico Seguros,"San Isidro, Lima","Asegurar un trabajo consistente entre los diferentes equipos analíticos desplegados en el negocio.
Colaborar con las tribus de negocio, los POs y los…",Postedhace 30+ días,Tiempo completo,,https://www.indeed.com/rc/clk?jk=2ab8b22c8f651a2f&fccid=510bd4f5f7b09b7d&vjs=3
Resilience and Climate Change Practice Lead LATAM,AECOM,"Lima, Lima",+ High-level view of systems and data-centered approach to problem-solving based on extensive background in ecology and environmental science.,Postedhace 30+ días,Tiempo completo,,https://www.indeed.com/rc/clk?jk=926eaddcb04847b4&fccid=bafa4b35e9cd20ce&vjs=3
Data Scientist,NTT DATA Perú,"Lima, Lima","NTT DATA Company es una consultora multinacional que ofrece soluciones de negocio, estrategia, desarrollo y mantenimiento de aplicaciones tecnológicas, y…",Postedhace 30+ días,Tiempo completo,,https://www.indeed.com/rc/clk?jk=3d13e7b396957439&fccid=83712bc14e85a819&vjs=3
Project Management - US Client (Olivos/Barracas),PwC,"Los Olivos, Lima","Handle, manipulate and analyse data and information responsibly.
The team owns multiple aspects of the technology delivery cycle, lead executive stakeholder…",Postedhace 30+ días,Tiempo completo,,https://www.indeed.com/rc/clk?jk=737bddd2ae9c851a&fccid=5e964c4afc56b180&vjs=3
Data Scientist Advisor de Pricing,Interbank,"Lima, Lima","Desarrollar, implementar y mantener los modelos predictivos, con enfoque en pricing que generen valor incremental para el banco.",Postedhace 30+ días,Tiempo completo,,https://www.indeed.com/rc/clk?jk=29e706cfe1a8530c&fccid=8359307539608691&vjs=3
Wildlife Health Specialist,,"Lima, Lima","Proven computer proficiency, and data management, particularly interested in advance exploring technology for doing this.
This is a full-time position.",Postedhace 30+ días,,,https://www.indeed.com/rc/clk?jk=7bc638cfb030ab84&fccid=dd616958bd9ddc12&vjs=3
Sub Gerente de Modelos Analíticos,Scotiabank,"Lima, Lima","Liderar al equipo de data scientists del área, dando seguimiento a los avances y velar por el cumplimiento de entrega e implementación de los proyectos…",Postedhace 30+ días,,,https://www.indeed.com/rc/clk?jk=7e1d2f7b821f2dfb&fccid=3002307a9e5b4706&vjs=3
Senior Portfolio Manager,Worley,"Lima, Lima","Using their personal experience in delivering “Alliance style” sustaining capital portfolios for customers, this individual will work with the business to…",Postedhace 8 días,Tiempo completo,,https://www.indeed.com/rc/clk?jk=79fca6aeba2f7900&fccid=d9805af20a6c196e&vjs=3
Analista de Modelos Analíticos Senior,Scotiabank,"San Isidro, Lima","Contribuye al éxito general del Área de Modelos Analíticos en Perú, garantizando que los objetivos, planes e iniciativas individuales específicas se lleven a…",Postedhace 30+ días,,,https://www.indeed.com/rc/clk?jk=e12c1cc9c7717439&fccid=3002307a9e5b4706&vjs=3
Big Data Senior - Remote Work,BairesDev,"Trujillo, La Libertad+2 ubicaciones","Hands-on experience with managing data loads and data quality a plus.
Write highly efficient Spark jobs to process TB of data.",Postedhace 1 día,,,https://www.indeed.com/rc/clk?jk=8a87ace370115a69&fccid=29707109e86166e5&vjs=3
"Contract, Technical Consultant (Rare Diseases) - Perú",PTC THERAPEUTICS,"Lima, Lima","Demonstrated success in interpreting scientific data and presenting research information to scientists and HCPs.
Must possess a valid driver’s license.",Postedhace 30+ días,Tiempo completo,,https://www.indeed.com/rc/clk?jk=bb28ff7080a27d28&fccid=01b550b2fa839455&vjs=3
Data Science / Data Engineer - REMOTE WORK,BairesDev,"Trujillo, La Libertad+2 ubicaciones","Hands-on experience with managing data loads and data quality.
Input data from those interviews into the product and help develop a predictive, fair, and…",Postedhace 1 día,,,https://www.indeed.com/rc/clk?jk=c899adc6ad874a0e&fccid=29707109e86166e5&vjs=3
Administración de datos Ssr. - US Client,PwC,"Los Olivos, Lima","Data Quality Assurance specialists help to manage and analyze data, and transform it into fact-based information, by increasing data integrity and trust through…",Postedhace 30+ días,Tiempo completo,,https://www.indeed.com/rc/clk?jk=242496369f995801&fccid=5e964c4afc56b180&vjs=3
UX Analytics,VASS,"Lima, Lima","Generar reportes y propuesta de optimización/mejora por hitos.
Profesional en diseño gráfico y publicitario, Data Scientist, UX Designer, Desarrollador,…",Postedhace 18 días,Tiempo completo,,https://www.indeed.com/rc/clk?jk=f841f6b8138ecc6b&fccid=7f25d1d1d564f968&vjs=3
Data Scientist,Factor IT,"Lima, Lima","Desarrollo de ETL's utilizando pentaho o alguna herramienta de diseño estilo drag and droop.
Experiencia en análisis de información (deseable información de…",EmployerActivo hace 15 días,Tiempo completo,,https://www.indeed.com/company/Factor-IT/jobs/Data-scientist-7f8b9162ef021136?fccid=574e7645c862913f&vjs=3
Data Scientist,Mibanco,"Lima, Lima","Fuerte aptitud para aprender y aplicar nuevas tecnologías de data Scientist y data Managment.
Generar conocimiento accionable mediante procesos de ciencia de…",Postedhace 30+ días,Tiempo completo,,https://www.indeed.com/rc/clk?jk=fb6bb1644faf6797&fccid=807d21144e98ee35&vjs=3
Data Scientist,CANVIA,"Lima, Lima","Si sientes pasión por la tecnología y quieres transformar negocios, esta es tu oportunidad para desarrollarte en una empresa inclusiva, diversa, que se desafía…",Postedhace 14 días,,,https://www.indeed.com/rc/clk?jk=2568497a7e125d70&fccid=df03affb8098432b&vjs=3
Software Engineer (Remoto),Xepelin,"Lima, Lima","Te apasiona desarrollar productos y funcionalidades que resuelvan las necesidades de las empresas y sus administradores/dueños, considerando feedback de…",Postedhace 30+ días,,,https://www.indeed.com/rc/clk?jk=6a3e6385051fc3b2&fccid=48d0bba2137f8e32&vjs=3
Senior Data Scientist,Encora,"Lima, Lima","¡Encora está en busca de su próximo Senior Data Scientist para incorporarse a nuestro equipo! ¿Qué esperamos? Bachiller/Ingeniero de Sistemas o Informática,…",Postedhace 22 días,,,https://www.indeed.com/rc/clk?jk=d904de29e0e3a75f&fccid=d7ebec345b9eaa0f&vjs=3
Data Scientist,Encora,"Lima, Lima","Experiencia en Desarrollo end-to-end de Modelos de Machine Learning (Modelos de Propensión, Modelos de Series de Tiempo, Clustering, Técnicas de Reducción de…",Postedhace 30+ días,,,https://www.indeed.com/rc/clk?jk=813dba2670c85039&fccid=d7ebec345b9eaa0f&vjs=3
